> your character is so yuck Thank you, for confirming my suspicions of who/what you are.	11,15	eezlp8n
many men should die trying to save her from having to confront her family.	27	edgs969
[NAME] believe in evolution and the hat isn't racist just because you say so. Quit trolling.	27	eeqj4jw
This is really great!!	0	edj7ssx
Sorry if Im slow here but what does Milan or [NAME] have to do with this? Hes going to Inter or Arsenal,no?	24	efcfzbx
This is the most accurate representation of BO4 I have seen yet👍👍👍	0	ed0xyei
oh no	10	ef1j5ed
Hope you had a great time!	20	ed14z2f
yeah. many people mentioned that. also Shield Brah questions beastmen racism .	4	ee05k5j
[NAME] looking like his older brother on that one.	27	eduz5yb
Not surprised, damn that sucks. Concussions are awful.	11	efdjog4
The joke here is that [NAME] is the ‘baby.’	27	ed5cwdg
She just needs to kiss [NAME]	18,27	efa717k
Humm, just a few days after I unsubbed. You aren't luring me back again though r/Murderedbywords !	9,27	eewut3f
I am not at all familiar with the gibbed audio extractor but I'd have to imagine those lines are in the Citadel DLC files.	6	edocabj
Mate, just stop. You’re being an embarrassment.	12	edn4skq
Didn't he say [NAME] should cave and give [NAME] his wall money?	27	eefj876
Or you just get rejected and then not murdered and your anxiety worsens until you can no longer approach women or even men.	25	ef59lqk
Who would win: The Green Arrow or 1 Electric Boi	27	ef8dx54
As long as the ink isn’t on a contract, I don’t listen to any rumors. Waste of time	3	edxzmd7
Last refuge of serous fluids and the dreaded endometriotic nasties.	27	edo91as
But then they couldn't be a self-martyring, violent tankie and that's not as much fun.	10	ee9tul8
One week sounds like a good timeframe. Good luck on your channel! I hope that expected revenue goes up for you.	5,20	eeb7cws
[NAME] lmaooo this made me laugh, thank you 😂	1,15	ef27f31
Don't ruin it for him	27	ee96fcn
Come back here and fight me m8	2	ef5zxbh
What a great photo and you two look so happy. 😍	0,17	ee0sak1
Poeling is looking like a fkn stud. Imagine our C depth next season... [NAME]... holy fuck	3	ed5t2xv
Yeah take a read	4	edbger6
[NAME] we support you! Love from Mexico I hope everything works out for you, whatever you decide to do!	5,18	edjuplh
Thank you!	15	ed4xm4z
Meh, the liga that we all knew and loved went away when [NAME] fled to Italy	25	ef5nqvj
Shouldn’t this be “How sex feels after your wife has a child”	27	ee4ly03
Wow those fruit turnovers look delicious id defo pay 3$ to have one	0	edyzva9
Maybe that's why it's interesting.	7	edb0oje
You can only nominate one unit and said unit has to be one that wasn't already nominated	27	edqkm3j
"I like the ""filler"" episodes, believe it or not. I actually get bored by the battles "	4	ed1u0am
Yeah, neither of them are communists. [NAME] is a left-leaning [NAME] and [NAME] is a [NAME]	4	efdlxf2
“[NAME] make y'famous tonight, buddy!” 🤣 Anyway, no manger for him!	27	eduiaap
>lox is optional How dare you put '[NAME]' in your flair! How dare you.. Mods! Mods! Apprehend this impostor!	2	ee3z9t9
The games are that expensive, because corporations have figured out that people will pay that price point. Now bugger off.	3,22	eebvykf
I bet there's something delicious in there that hornets do make	4	ef9wn9s
thanks! yeah a bit, wrote for my college paper last semester but thinking about doing more	15	eddcqi2
Me too! And he was so happy to get that out of her back, he seems like he really cares.	17	eefdghv
i was not prepared for this	9	eehyh8g
Good luck to [NAME] if he really thinks he can take over the country with the most armed citizens. Trump derangement syndrome is real.	27	ee9ysrn
I read that too and was nowhere near as useful as being that valuable.	4	eemuzof
[NAME]	27	eeeysz9
Thanks for making me laugh my way into a sinus headache.	15	edscw42
Thank I may just try to find halal store and buy snacks that are popular . I heard even marshmallow may not comply.	15	edh1xq1
I had a crush on this guy ever since I saw him as the mad hatter on OUAT.	18	efbpt3r
>I thought we were retiring the older guys. Because the geniuses on reddit said so?	6,7	ef4uuod
How do people eat off paper plates when they’re not at a bbq?!	6,7	ees0dnm
Oh haha I didn't see that!	1	eelbfff
It’s a shame we have to face the islanders so soon	12	edevj3j
Ok.... he can *call* it the State of the Union, but that doesn't mean it is.	10	eet0t1s
I'm glad you like doing - you can feel the darkness taking over haha. This honestly sounds like an animated short?	1,17	efavbk8
Sad part is there’s Flames fans that think this is true	9	edxoxsd
Maybe 10-12 years ago lol	1	eeym93s
Guys a vulture who is feeding off people's fear.	27	eeiunjp
Yeah, why can't a guy get regular coffee anymore? Keep your crappy organic frappa latte and get off my lawn, sonny!	27	ee9gubo
I don't need to have [NAME] as my husbando to love my mom	27	eelpfh3
Omg where did you get this?	7	ed4gsmg
Lol I need details!?	1	eem6m7u
>cumpoo Now wait a minute..	27	eei33tl
Can't even do that anymore :(	10	eevyn9h
Wi-fi and 4G ARE microwaves, and it IS radiation. 	27	eeypbg1
Thank you. I’ve been feeling a bit better since they make people happier.	15,17	ef1alch
Excellent, this is exactly what I was looking for. Thank you !!!	15	ee52bva
I always hope that a woman will ask me out...next time it happens will be the first.	20	ed7a12w
"I wouldn't be surprised. Where I live leavers quite often tend to refer to leaving the EU as ""leaving brexit"" "	27	eemk6ha
Good. Thanks everyone but finnaly some reading material. Many thanks	0,15	edell8j
I watch almost every Bears game as I am in that market lol	1	eel7ng1
for sure not natty	27	edykmd3
It’s like they’re in the middle of a pissing contest.	27	eeo11rh
I mean, that’s great, but would you start dating someone you didn’t think was attractive initially?	0,7	edtd728
We’ve been watching OP for awhile and warned him about his posts. This one doesn’t rise to the level we warned him about.	9	ed9wp84
r/nba will find a way to hate.	27	ef2gmf8
Stay strong, you’ll pull through.	5	ee60sn5
FFS. I find very few things more upsetting than reading their vile, twisted thought processes. 	9	eedfxha
this needs more upvotes	27	eephmsd
Over-levelling is easy to avoid you just turn off exp-share Except no one is going to do that because arbitrarily grinding is boring	27	ed2regx
Well I got checked at the last Toulon game haha, so not the case.	1	ee2c97j
But asking kids he teaches about him and then telling us that. Weird flex	27	ee0q2km
Change politicians' healthcare to that of the average citizen, and this could all be sorted out much faster. 	3,4	edjzp2e
Revolver is pretty beast tho, 2 shot close range	0	edbzu1q
Came here to see if i was the only one. The whole edit is one gigantic mess.	3	ed6znzl
Sad but true lol	1,25	edzvnzh
Then how can you say the rest is very red outside of nova when that is blatantly not true?	6	edpk8kb
Some people have more/less empathy than others. If you're incapable of feeling what others are feeling you're going to be a selfish person.	27	eff6moy
This can't be serious right? Already 14930 supporters have signed this crap!	6	efdw96p
Its literally bread on a bread board, whats the issue here?	7	edaegtk
Mornings can be hard, lol.	1	ee0whrk
She won’t lose fans. If anything she’ll introduce her fans to this sound and give them a reason to love it.	27	edxxysi
oh shit u meant the actual post... yeh i live in china this all we got😂😂	9	eec4uf4
actually OP’s account	27	ee8vta8
Can someone give the non-paywall link? I know there's a way but I can't remember it.	27	eecgytp
It’s funny	1	ee8bamh
ORANGE MAN BAD GOLD TO THE LEFT	27	edxt5o9
Shoes in flesh-matching nude are as bad as leggings in flesh-matching nude	27	edm696s
Ur mom causes a 2.6 just getting out of bed in the morning amirite?	7	ef5ti2e
I was also bullied at work. I was on lithium for a while. You're not alone.	25	edkc35l
Then it was effectively them pissing on your territory. Same with the bed. They don’t get to pass the threshold again!	3	edl7hm1
Why on earth couldn't she just bring a hat from home if it was such a big issue to her? Lol.	1	edafifr
Do you orgasm when you’re on your own? Are you a virgin?	7	efeb5k6
Maybe they mean like older kid free? I'd contact the coordinator and ask them if your baby is okay.	6	edl0v2f
The app trio is the only thing worthwhile there. Won ton tacos +boneless wings + spinach dip and I'm a happy camper.	17	eda41x4
Let their deaths be swift	16	efex9wp
Thank you! Do you know what agency would be interested in this information?	15	ef6goma
oh pigs arse ya cunt! if you don't say togs you're [NAME]	27	eefigj6
Let people be into things you don’t understand.	27	edq27e6
Thanks for your words. I appreciate hearing from you. You bring up some very disturbing points.	0,15	eevsd4k
Sadly, it looks like there are a ton of [NAME] in this sub	25	edbwl1i
Yikes at that title dude	27	efepbfx
It's also cruel how noone is informed about the execution at all. Relatives are left completely in the dark and likely never find out about their execution.	11	edp9ew4
This video doesn't even show the shoes he was wearing...	27	edf75do
Yea we need more good news to give other people hope, enough hope to give them a helpfull push to pursue what they really want. 	8	ednug8v
I'd love to hear someone argue in support of our current income inequality..	8,18	eec6gr2
That woman has a nice body	0	eetpc77
"""WE HAVE LIFTOFF!"" ""Houston, we have a problem"""	22	edqbnvr
I'm stealing the tv tonight to watch the [NAME] tapes. He hates serial killer stuff	27	eexvy5g
Finally somewhere where I'm just an average fucking person Fuck why am I crying	9	ef5d8bo
Here’s your participation award	27	edu4q4w
I'd say we should dump him somewhere at sea but the oceans are already pretty polluted... :(	9	efdttia
Annoyed by the people refusing**	3	efal10u
Well, I never thought it was entirely coincidence that we got bad when [NAME] went to Ireland and got good again when he came back.	27	ee9v6ls
Who would have guessed Libertine Gold and Black posters would be coke heads?	27	eedwzyf
Why would you doubt it dumbass?	7	eduun99
They mug you and ruin the country	3,27	ef8cq4j
BOOP! Go Stars!	27	ee5xona
Well... this should get interesting.	13	ed9s77k
Nurse is by far the most loyal team mate we have!	27	edfs10v
Imagine being born in 1987 and not having been invited to a party since your friend's birthday party in 1999 though :(	25	ed6hla8
i do love how absolutely distraught the girls look	18	ef4qba4
I hate [NAME] and [NAME] for what they've done to this franchise. And I'm growing to hate [NAME] as well.	2,27	een7t8w
Fair. Actually fuck the last few songs on Bleach.	3	ef3h896
Boy where is you. We use to race on the parkway in highschool lmao.	1,27	eczep0r
I just hope the show brings [NAME] back because she was really great.	0,20	eemkiob
Isn't North Dakota more important? Or are they just the sacrificial canary in the coal mine?	6	edta2p8
Sorry to hear it man. Grief is the appropriate thing to feel. I hope she is happy in the afterlife. Peace be with you both.	16,24	eeojkfl
"I did this for Christmas to coming home. Somewhere in Illinois I said to myself ""fuck this Im flying next time and renting a car."""	22	ee0wczu
I’m so sorry for your loss... if you ever want to queue PM me for my steam	24	ed1w3qg
She's digging herself a nice grave for [NAME] to bury her in.	27	efdto32
Let’s see, this house is designated Zone R3, which allows for cats, dogs, telephone answering monkeys...	27	ee2o76a
Ah sorry about that won’t happen again	20,25	edrtc1r
Sure, rape isn't caused by poverty. You can compare poor whites vs poor hispanics too. 	10	ee32d6z
Oh so you're not even a believer..Yeah, there is nothing for us to discuss. Thanks though.	3,15	ef8uhrh
Thanks, that makes a lot of sense. I feel better already :)	15	ee1pnw9
Ok, I gots to know, was the child taken away? Please tell me the child was taken away. 	7	ef9f2fx
I like this kid	18	ed4qssq
You dropped a ‘want’ in that last sentence my dude	4	eetx6gb
Incredibly stupid if they are caving to the anti-gun rights lobby! Not like [NAME] are big fans of gas-guzzling monster trucks...	27	edxdbzo
I mean there's some truth in so far as the criticism should be first and foremost directed towards the parents, with [NAME] in a close second.	27	eegbsuu
"""I'm not the one constantly talking about getting laid, YOU are!"" "	3	eeqdye4
Wow so glad [NAME] is getting it done quicker. Better for later in tourney	17	eenor4z
[NAME] is a 2 guard in a small body. Cavs fan's have been saying that they need a playmaking guard next to him.	27	eei5491
being rich is the opposite of a weird flex. it's just a normal flex.	27	eds3cta
It just looked like blue fire to me. And I think there was a behind-the-scenes thing that said they made the fire blue to differentiate.	27	eeqjdk6
Ohhhh, that makes sense. Cheers mate 	13,17	edws4jx
Yes. Ask him out. Give it a shot. Talk with him.	27	efarr87
23/68 last 9 games. Yeah that’s a bad %	27	edjftzf
I guess the trick is not to eliminate susceptibility to 51% but to minimize it extremely.	22	edmgb6r
I fell asleep with the feeds on last night and woke up pretty frightened at the noises coming from my computer. Thank you for casting Tom BB hahahaha	15	ef4futj
No actually my therapist is amazing! I've just had bad experiences with doctors in the past. I meant I'm worried the doctor will say that.	0,14,19	eez99n5
Someone you guys are on Grindr just to screenshot your own witty replies to men trying to bang you, don’t deny it.	3	eedyumx
Ok, hope you are right	20	eesjwpa
Sure, but he still died again a couple of years (decades?) later. So the copyright is still up.	4	eebiep2
Nice, i have the crown help me and the 309. Can you compare it to those?	7	ee4dtda
Hey, at least its not a fucking sauce post! We really need a new season.	3	ed53y2u
happy to help	17	edmon0x
i’m so glad you’re doing good now! have a great new year and keep pushing on my guy!	4,17	eczk6qs
Ah, the good old days where you could lose in a game! Yes!	4	eekx2q0
I'd be honored	0	edrvp1o
"denying and lying or walking into a minefield what ""nice"" choices @.@"	27	edo536k
Idk what dumbass downvoted you, somatotypes are bullshit lol	3	ee3urb3
He's a garbage person. It's very disappointing. I liked him so much before.	9	ef9qyfi
Well, bless your heart	27	eegps09
Oh yeah! He was great for us. 0.69 ERA in 24 G with 10.7 K/9. I forgot about him.	0	ed88eg2
he blocked me right after 😂	27	edfd4y3
Taxation is not an aspect of socialism	27	edjipmw
[NAME] voice acting in this is just brilliant.	0	ednat4n
You’re absolutely correct	4	ednjjfw
Mr. [NAME] Moderate himself. I do hope the DCCC pours money into [NAME] rematch campaign when he declares.	20,27	eeai4qq
I'm not to proud of them right now. I'm mad at them ☹☹ But big ups!!	3	ed0lgce
I'm surprised they've gone this long not knowing [NAME] swears a lot.	26	eczkjtx
No, that would be traveling to Florida and challenging [NAME]. Georgia is definitely still rather red ... Florida isn't (as red yet).	27	edvvslb
What does that even mean? How does one decide right or wrong with something so vague?	6	eemjk1m
I don’t get why he hasn’t brought his insta account back, he did used to use it from time to time	6	eduux4x
Out of curiosity, did [NAME] mention autism?	7	eeuf0ay
Still as confused as the rest of ya myself.	6	eez2qeg
That's not fickle. That's insane and delusional. It's not some cute little quirk. It's a disconnect with reality.	10	ef7a6pm
ooh boy that guy went off the deep end and drowned	16	eezm7wh
Yeah right like they always talk about themselves why can’t I gets me so pissed off	4	ed8x2fo
Lmao we really tried that again	1	eeva9qx
Nope, not me. I am primarily a cyclist and drive as little as possible.	27	ef4i2ed
Idk why you're surprised. [NAME] and [NAME] had identical philosophies. It's why the offense didn't change when he came back.	26	ed63cd7
I like it	18	ef713c5
The housemate is a genius!	0	eeudc6t
Go on...	27	ee9j8tg
Apparently measles are worse for adults, ironically due to stronger immune systems.	27	eevp086
HOLY HELL THATS HELL OF A BURN	27	ed36ckq
It's amazing the advantage that you have when you advocate for the ruling oligarchs.	0	eesx544
You are right.. There something to be said after banging both your mom and gf while they are on the rages.	4	edojun4
I'm hoping this is a 12 year old trying to be funny	1,20	eeslqsd
no clip as an example to backup your claims?	6	ee5jeoy
The abilities look cool, but that trait is a little dull. It's almost exactly the same as [NAME].	0,10	ed3bdji
on the subject of meltdowns, stay calm yourself and try your best not to escalate them.	5,27	edc8h9v
Ignorance, Illustrated	3,27	eexaybk
After reading this comment, I wholeheartedly hope the rest of your life is beyond wonderful. 🤣	20	ed79qwm
I've been a Rams fan since the first Rams vs Pats!	27	eelfvs2
My name is [NAME] too. It's so strange hearing my favorite bravolebs say it on TV.	26	ee6lj3g
Mental illness. Operation on 7 people in a manic state . Four of them died. All his money was gone and his rich friends abandoned him.	25	eebhggp
Also, note how the First Order recruits....children. That certinetly could lead to rampant abuse.	5,27	ef7ap0i
Don’t forget that he’s only 23 years old 👑🔥	27	ed9zmu8
That's so sad.	9,25	ef4tys1
Sweet thanks for the update. I hope the kitty finds a good home	15,20	eefw7lx
"Calling him a criminal isn't an opinion. That's like saying ""the six foot tall [NAME]."" It's either true or not."	27	eexq42d
Why would you assume he wasn’t in on the decision?	27	edekyaj
0% But then again most of us on here aren't placing top 8 at majors so that could factor in	10	efgz0v1
So THATS why the sheep followed that pig in that Babe movie...	27	eez9h34
This is awesome! Do you want people to RSVP? Or are you doing this first come, first served?	0,7	edszp4e
be your own goth girl	27	edmupj0
We do what we must	27	eeepmng
After 3 sacks today, “Are you not entertained?” -[NAME] probably 	27	ed1lt4p
[NAME] - OT3 in my team without me... [NAME] - Sometimes bad things just happen...	9	eed6jhn
I can do that too but I have diarrhea	9,25	ee0xepi
I regret this knowledge, give me back my ignorance damn it!	24	eeucvnt
I used to think smh stands for 'somehow' until I finally googled it. smh	27	edw1gf6
I like flirting so this is what I enjoy doing, plus ordinary flirting is outcome independent. Direct approach is outcome dependent. Either way it's all part of the fun!	17	ee6u6q8
I love [NAME]	18	eeivw4n
i know, [NAME] sucks balls	27	eddm3hj
Fake news. This video has been thoroughly debunked, here:	27	ee9ic2i
I'm so jealous of people who have natural red hair. I think it's so unique and pretty.	0	efa3r78
that's some nice evidence you got there.	0	ee4nany
It's Cursed Ryoma	27	eddwkel
Don't worry. You'll grow out of Pearl Jam.	5	edtyc4k
So is that like your opinion or a viewpoint you can back up with solid reasoning?	7	efbhatx
"Seriously this ""tastes"" avalanche is gold I'm cracking up"	27	eetlogf
when you j/o before hooking up with a girl so you last longer	27	ee6e35v
Take a shower brother, i can smell you through my phone	11	ef4nswg
Technically, if [NAME] are right about him, then you already did nail him... soooooo...	27	edohckn
Also, this has been said half a million times but the Oilers were not picking [NAME] with that draft pick even if we didn't trade it away.	27	eej89tz
[NAME] was the worst Of any sports team Unis!!!	2,11	ef25xxu
Hey, take that grade with all the pride you can muster--no shame in being happy for an accomplishment! Congratulations!!	4,21	ednk5rc
Thanks man I’ll try, you stay strong too!	0,5,15	edahpld
Don't use autism as an excuse to be an asshole	2,3,10	edz2gud
The powers that be don't like it when you try to educate the [NAME], but that's to be expected.	27	eep7p99
this is amazing	0,13	ee0dwa2
If everyone is wrong I'll still point out that everyone is wrong, doesn't matter.	27	ee6veit
They didn’t even respond to my email so I don’t think it’s gonna work	3,9,25	ee0v1hu
There is a reason youve never seen a cat and a narwahl in the same room	27	eeundjq
The deputy declined to identify himself or say what game he was playing. Definitely Fortnite.	27	ef4dfak
Stay strong and keep going. Chiche but true : living well is the best revenge .	5	ed5pz0v
To drool on.	11,27	ee84xf1
[NAME], now you have my attention. Do you want your fun fact or no?	7	ed3qgqr
Human trafficking is bad.	10	ee1msax
OMG BARF wtf is wrong with people?!	2	edd64fu
I drove through there dropping off an uber passenger and I was really amazed by how beautiful it is.	0	edci5bk
Good. I'm glad that you are getting help.	0,17	ef4ow95
Might I suggest if you give yourself an epithet with the word 'prick' you are infact inviting a little denigration from the jaded?	6,7	edm9g16
Dude. His wife and baby girl.	27	eew1slt
Thanks for the info, give credit to the artist	15	edwfyp7
Gotta love Texas high school football for exposing me early.	18	efarrhc
It really sucks that almost everything we know and love about [NAME] is either told to us by proxy through other characters or is the result of fan-fics/shipping.	3	edkkzq8
I wish you have a best luck on your journey.	5	edc664g
How i wish i was there rn.	27	edpw499
The stadium isn’t a draw, it’s using space that would have otherwise been available for more housing 	27	edyn1lu
This was beautiful!	0	edd01hp
It was not my ex, I just watched her in action.	27	ef4zuyq
Great work guys! Always A++ Prime casters!	0	efg2ce3
We had a baby, it's hard to find the time to take them down.	25	ee2lqnl
Still looks pretty delicious, makes me really want an omelette rn tbh	0,8	edd5bc2
They look pretty great tbh stache and all	0	efagn72
It's normal school except they sexually identify as [RELIGION]	4	edls9bt
So, the kicker... her brother played on Xbox so that's the console she had claimed to play on!	27	eeps8io
Go to Happiest Hour before/after the game. Walking distance b/w AA center. It's a fun spot!	17	edkngiz
A credit score is not important: Convince me otherwise.	27	ee0x505
I came in here to ask why he’d drive so far to see a movie about testicular torsion	7	ee5mbfj
Mate none of these are accurate. I only read these articles as an excuse to get mad at something	10	eejlgu3
doesn’t QCX work with them ?	7	eentsui
Hi! :) Because I am broke, I guess.	25	edppag5
Fuck man I didn’t plan on crying in my cube today	2	efgykp2
They’re all so damn gorgeous. No complaints here lol	0,1	ef734dm
Well, exactly that actually, lol. 	1,4	eeq5ixf
Chocolate hazelnut croissants were the bomb!	13	ee3aw0f
>You can't purge dissenting opinions over there like you do here. Yes, because top minds definitely doesn't purge dissenting opinions. 	10	eedegbl
That is a good idea. It may be hard for him to make any progress with him coming over so often. Thank you for you input!	0,15	ednhqcn
That was a terrible pass regardless. Wasn’t close	14	edcmilh
You’re a vile vile person and a rapist. I hope the police are onto you.	2,27	efgxis5
Easy, stop men from fucking them. Cant be a slut if no one fucking ya right?	2	eeit91r
cool, I never said anything about communism, that's a pretty wild non-sequitur 	27	edfwjqh
they could be extinct. plenty of creatures no longer exist anymore.	27	ed6fdgf
Aww how can you hate the little darling, it's so cute 	0	ef7ym4f
I threw my only book away so I could go catch Pokemon creatures	27	ee8w3pa
[NAME] looks like a guy who owns a number of body pillows and anime figures.	27	eem9xuu
I am starting to get very concerned with [NAME] and [NAME]	5	edmzfn0
"""And then you divorce them and date your stepsister."""	27	eeug39y
Everyone makes mistakes tho... at least he only allowed 1 mistake to go for a goal	27	edxou5w
The only place open for dinner in our part of Seoul during Chuseok was a mediocre Chinese restaurant around the corner from our hotel.	27	edto8nf
You're right, that's a solid advice. I will give it some time and if I am unhappy I will start distancing myself. Thanks!	4,15	ed3mm40
"No, the root Arabic word is ""hashishiyyin"", with it's Latin translation being ""assassinus"". Assassin is the French translation. "	27	edzrmyy
Your welcome.	15	ee5jpvz
❤️ you are a strong individual and there is an amazing amount of support behind you	0,5	efdjx2j
Try not to cringe challenge.	27	ed5c2xk
All we need is 1 more Trae three and the W and this’ll be a great night	13	ef8kh0a
"[NAME] isn't facilitating anything between South and North Korea. The only thing he can take credit for is no longer threatening ""fire and fury."""	27	eespa30
Yeah that happened to me twice a month for years with an ex. Maybe someday we’ll do it 😅	20	ed9efwc
1. Left tiddy 2. Right tiddy	27	edtuuu6
I am so terribly sorry you lost your dad to this horrendous disease. Judging by this photo, he had a terrific smile.	16	edgos69
This is a rough sport we follow. Simply training makes you pay the price.	27	eevm13t
Need context on this lol. I'm on a Uber rn to a bar so will be drinking right with you!	27	ee3nwga
I mean, you are in love with them regardless. But I always knew when they were going through an awkward stage and such. 	27	edxy2z9
The worst is when those moments pop up randomly. Especially when you’re feeling happy and then a mistake you did back in 2005 comes creeping up.	2,17	eczsex7
So glad I moved here.	17	effxeph
They lead a bad defense though. And [NAME] isn’t blameless here, he’s not good against the run.	10	ee5lj9o
Yeah, but if they don't get the point, they go and try somewhere else... like say unpopular opinion maybe	6	ee1celt
honestly i don’t mind it but ik some people do and i rly don’t care enough to get into that	3	ed5qevu
Everyone's job is tough so why not treat everyone with respect?	22	eepcocv
