My favourite food is anything I didn't have to cook myself.	27	eebbqej
Time to do my thing.	27	eeql4i6
EB GAMES STILL EXIST there?	7	efed5qa
Kinda reminds me of Arctic Monkeys' 'Favourite Worst Nightmare' cover art	22	eepxomb
Your girlfriend is a woman of culture.	27	edh095l
I’m sorry you were down voted. I am asking for real honesty, so thank you for telling yours.	15	eczp256
I do! I buy 5-blade Dorcos. I'll never go back to razors marketed to women.	4	eef4tc6
Nah I get that, it's just AFFIRMATIVE action...unless this went over my head as well lol	1	ee8rshq
Not really sweaty palms, but holy hell that's uncomfortable as all hell...	10,11	edmfzsp
I didn’t know there are different levels of “park”.	27	efasebh
Little did you know 95% of these kids just don’t want to go to school	27	eew3nll
He was an awful HC, is in his 70s and has repeatedly said he doesn’t want to do it again. 	11	ed0en85
Yes, but assuming that our government right now wants students to do better might be a bad idea.	27	eexicvd
I had the same thought, I didn’t see anything notable about this at all.	27	edxhzpo
Mate just go out and get yourself a steak dinner, you will enjoy it much more than Artifact.	17	edylvqw
The funny thing is [NAME] would probably be up for it. Let's do it! LoL sAiNtS	1,20	eepwisg
Miner rewards are being reduced from 3 to 2 ETH per block. Why would that indicate a sell off?	7	ed2vxqv
Not this time	3	edriany
Yes but the way she does so at the moment, with makeup and bracelets are a bit uncomfortable for her, she says	27	efgtfru
Ahhh. A civil and interesting conversation on the internet. How refreshing.	13,17	ef38dvr
Its natural to fear what is unknown. Especially when someone is trying to force you to open a sketchy box while probably grinning the whole time.	14	edzn3b8
I love snow! It means snow days!	18	ee4ggkr
As long as you do the cooking by the book 😏	5,20	edgio11
Konami?! They havent made a relevant or decent game since the 90s.	10	ee48de5
[NAME], she really is my least favorite queen I drag race history. Boring, try-hard, and busted makeup.	9	edaq83k
Quit being a crybaby. If this how you handle any criticism then it's no wonder you're alone and will be for quite some time	3	edkw70m
Sadly, I don't even think its that the Chargers aren't prepared its that the Patriots are good at game prep.	25	edzsf1m
Except he does literally every game, but not everyone can watch them. 	22	eezs397
I am not... Coast guard is not getting paid right now. I am sure they have families depending on that money.	27	ed33yw8
For cart pushers, I can’t recommend getting good winter/rain gear highly enough. Good socks and waterproof/resistent shoes will make a world of difference.	4	eednd1p
Yay! (Tech will be improved. Eeeek.)	17	edoeypb
yea, get back to me when the deal is done. 	27	ed3ehla
I want to see him succeed. Mostly because his last name makes me think of the bad guy from Shrek	5	eenl5g0
And? Abusive people apologize sweetly too. Doesn’t make them any less aggressive and in the wrong.	27	ed8bumh
**SHOW SOME CRYING FANS YOU COWARDS**	27	edjfcbq
No need to bully me.	3	eeqpiu3
53 months?? That is insane, must've been a different type of octopus then the one I was learning about. 	7,26	ee3zmb9
Right? No one brattier than incels.	7	eeem1iu
That's where gen Z begins. Every 3-5 years the next 'wave' comes	27	edwp55w
isn't a different model for [NAME]?	6	edks1gr
Death's sweet release.	27	ed9pqqg
Hmm okay, maybe I was just arriving at threads too early or something before they got cleaned up...	4,6	ee3ow6k
Huh I guess hes gotten calls to help someone bury stuff	27	eeqph79
Ha. It will start calling my neighbors slurs in no time	27	edjfda2
Me, because I'm a narcissistic bastard.	2,3	eelilw7
Thanks, ive been thibking about telling the school principal, maybe itll help	15	ef5ehe8
Reddit is so right wing I can’t even believe it	10,26	edfsmye
Jazz fan here. I completely feel. [NAME] cousins has more votes than [NAME], and [NAME] hasn't even stepped on the court this year	4	ed7g82c
Did you see on ig where HER MAN offered a fake [NAME] profile use of his pj 😂😂	27	edcfgoy
Just be glad you’re not his wife	17	edeu38u
That was truly disgusting	11	eenfvuo
I support the idea of punishing [NAME] without trying to injure [NAME].	4	edzy9yw
For a second I thought he was on shrooms	27	ef7v807
[NAME] this is pretty funny bit of info he just revealed I guess he showed up and they were like yeah u got final say deal with it	1	ee2dou9
Probably would just tell him to not worry about it that much and wait a bit and try again if he felt like it was worth it	27	ee86arf
wrong place thats hilarious	1	ee2v10h
Speak for yourself. Our defense crumbled under incompetency despite the talent they had to work with.	27	edncazu
We understand! This is a very common reaction to our study. I appreciate you suggesting it :)	0	eexgy7y
This world doesn't deserve baby sloths!	3	ed3stkw
[NAME] got in before [NAME], but other than that...	27	efdstqa
Sounds like how I brought in the new year. 3 arguments and counting.... thank [NAME] there is work tomorrow	15	ed25m8w
This really hurts my feelings.	25	eeoq6kz
Maybe we'll just stop moderating for a while to celebrate TWOW.	17	edqfnrl
Wish me luck fellas need Houston +8.5 to win $1700ish currently 113-114 Come on gambling gods	20	ed7fc1h
I feel terrible but I do this too, or watch obese people doing mukbangs	14	edmo7rb
Wtf are you taking about? What does that have to do wi- *checks post history* **OH**	27	edrmt0v
"I think it was [NAME] who said it: ""The best defense in the NFL is a 2 TD lead"""	27	eemj7s0
Da’ts a beauty. Got sniped at auction with seconds left to lose [NAME] from this summer.	0	ed3334c
Is this also where I brag about the fact that I’m gonna get laid too?	27	eez5887
I honestly would've sued anyway. You could have died, and all you got out of it was a guy fired?	6	eetnrom
Lol! Too funny. Mine are depressed, they gave up. :(	1	edv2muf
You contradicted yourself	5,27	eeypr52
You are the only person you can depend on	27	ef3vfco
I'm livin' in 3019 over here	27	ed45xs7
I can finally play 'Kabhi kabhi aaditi'. Only hindi song I listen to.	4	eefr6l2
So. Damn. Greasy.	3,11	edz6qc3
But his parents love him and that's what’s important /s	27	ed58sf1
Luckily every elevator would be broken at all times.	17,27	edhhrko
you forgot miracle, fake fan	3	eeqzfu4
Thanks, now where's eyebleacher?	15	ed7ylxs
Wow what a fucking autist. Probably more effort into this shit than all people that hate on GS combined.	2,26	eex2ibr
This guy journalists.	27	eeo6vht
I bet they're the kind of teacher that says something totally wrong and then power trips when one of the kids calls them out.	27	efb5mc4
[NAME] looks really hot in this pic for some reason	0	ednuk54
Pretty sure [NAME] graduated, and I would assume the [NAME] thing has to be related to the injury...	4	efadtgq
Didn't you get the PM? Post to /r/CatsWithJobs instead. Edit: It's already been posted there actually.	27	eeas7kw
aries actually haha	1	efdtnah
And yet OP couldn’t imagine a world in which they kept their brownie at their desk 🤔	27	eefxypz
They could tag this for all of their videos. They are all gifts we do not deserve.	27	edizzc0
suck me beautiful	0	ed3pewn
Sorry the cognitive dissonance is too much for you. Why don't you go back to listening to Nickelback? It'll make you feel better :)	24	ed257m4
Both [NAME] 3s in and out :/	27	ee0sopw
this is probably one of the top 5 most legendary copypastas from this community - I’ve always loved this one	0,18	ed0yjud
Its worth the risk	27	ef92e1k
“and THAT’S how you kiss!”	13	edd0asq
What a wonderful world you lot live in!	0	ef4glcl
so cute	0	edmc2yq
I've wanted this for so long.	4,8	edljlrc
**GOD DAMN YOU, FIGHT BACK!!**	0	eei7ati
"I felt it once, then I quickly realised I was horribly mistaken when someone better came. There's no such a thing as ""the one"""	24	edih0nu
[NAME] was an awesome Chief. Wish we would've seen more of him being a badass.	0,8	ed0omrl
heh, I remember that commercial.. Was pretty cringy	12	ed7wr4n
I mean she's a capitalist too. Not saying the accusations aren't rooted in sexism but like how about we just stop having rich people...	27	edwmzi8
I think the best way to think of the age is that [NAME] is 17, [NAME] is 19 and [NAME] is 20.	27	eed6b5e
I'd give you a shovel so you could dig your head out of the sand, but I have a feeling you'd refuse.	3	ee78nq2
Coinbase LOL people think place is the answer. I think it’s Cancer.	1,6	efded9t
for a moment i got scared and wondered what was this doing here then i read the happy ending	14,26	edikiqt
Exactly, or they thought he was saying it jokingly. The delusion these men live with continues to amaze me	26	edcugz4
True, but I meant he has no holiday themed skin from any of those events and all his skins (volsksya included) are pretty bland sadly...	25	eewmg5r
So, so many hugs and high fives! You are an awesome momma. 	0,17	ee2stiq
That's just how to look good in general	27	eevt08e
This one will provide tasty meals and a cute pup too	27	edlbtk5
I think, on my next play through I’m going to save right before so I can keep going back and reliving this night! Lol	27	eerzdwu
It's got home made bread pudding so therefore the rest has to be good!	20	eevaqso
Nice job building yourself btw	0	eei3ii9
He really channeled his inner [NAME] for this goal	0,4	eevfdxy
It seems the doctors have some explaining to do.	22	ef2jbh4
It do be like that sometimes.	27	ed8qsj2
Really that's not very sad at all	10	edypjzp
Ah, I remember you. You were mentioned on this subreddit before as a magnificent player.	27	eebmokf
I found it really kind.	0	efeucxy
How long have you two been together? Have you talked with your bf about any of these concerns?	7	ee2pq0s
I still don’t understand what did [NAME] do? Lol	1	eet6acn
I never knew it lost any so this is kinda news to me	27	edbnadp
i love [NAME]. itd be incredible to see her	18	edcwcxl
Really curious how families handled this in the old days before the modern health care system.	7	edvohv5
Which means his lifestyle is unsustainable. Look at the house and the cars. Even renting he’s just racking up debt pretending to be a millionaire.	27	edl8z8e
Your wife is smart.	0	edqzmpy
No, every movie shouldn't be like that. But a good protagonist is a good protagonist! 	0,10	edjh97l
Holy fuck, report this now. The fuck you doing on reddit? 	2	ee056pm
Happy Another Day random strangers!	17	eebo8gg
No way a tattooed ex-con with a drug/drinking problem might turn abusive!	10	efdatsy
"He's saying he did very poorly though. ""LOST ALL but 1 or 2."""	27	edafc99
That's a better love story than Twilight!	0	ee3p6u2
we need to deregulate more so we can beat them. america needs to be #1 in something	4	edkq93l
I like that [NAME] is still [NAME]	0	ed7z9wl
[NAME] only sends angels when he wants you to fuck 14 year old girls	27	efdtj6m
Wish they'd update Trapper's and Wraith's. They're so boring.	9	ef4jl0a
I'm sorry.	24,25	eewt98f
[](/ironwillthumbsup) True! Weird, but true!	4,11	efah7ba
I just use undercrackers or crackers. Knickers/panties sounds weird when I say it	27	efcwgis
My favorite pod when they are fresh & clear. Sadly, all of my recent packs look like dark brown syrup pods. 	9,25	ee7j34k
If my buddy was getting his ass handed to him like this I'd laugh too. Sometimes people just deserve a little ass whoopin.	1	ef0pkfb
If they're not spending this year on [NAME] or [NAME], I have no faith for them to spend on big free agents in the near future	9	ee5zgpw
I love learning, but I can’t be asked.. 	18	edosxqf
She's doing so good!!! I'm rooting for her hardcore!! I like her.	0	edojx8q
OMG the ones they sometimes sell that are just one giant piece. LOVE	26	eeytdjm
That’s horrible. I’m probably going to donate to them I can’t imagine not missing out on a season because someone stole.	3	ed4mcsu
[NAME] is still trying to wrap his head around how the Browns got [NAME].	27	edn40tp
I don't have a problem with it if its a cheese or charcuterie board	4	ee5tqqq
an obvious joke	1	eetd7i5
cool cool...	17	ef9tfnc
Whoa you are on a big brain level!!	0	edv6tie
I killed. Last thing I want is to [NAME] don't trust [NAME] anymore, as he will always remember that he could have saved [NAME]	27	ef13xyp
Getting outshot 12-5 but ending the period scoreless? I'll take it.	27	ed48abl
When you stop making garbage takes, I'll stop correcting them	20	eeiegak
Ok for what it is fake or not this is fucking hilarious lmao	1,6	eecxait
USA Trash is [NAME] beloved gift to Canada. Thanks [NAME]. Nice hair though!	0,15	edfwims
you deserve love too	18	edd8fvi
Because people hate freedom	2	edqruhw
Looks fun up there	1	edrnuax
Holy shit he hit him hard	3	een4mkr
U damn clown, she prolly felt so embarrassed and you’re just like meh	12	eds66tg
Yet when you decided to fish for validation by sending someone nudes, you chose the masculine, handsome, man.	27	eddf2nt
The article mentions that the apps are only for Chinese customers. Is that not the case?	27	ee7i4fd
Hang in there sister, your body will one day be your own again :) 	27	edpgmsy
Read: A Billion Wicked Thoughts: What the Internet Tells Us About Sexual Relationships It will reveal all	27	edskz6h
I honestly couldn’t care what you think of me random person on the internet.	3	eevf3dt
I'm not even surecwhat it is why do people hate it?	6	ed2v1mt
It developed because of my childhood and robbed me of a good bit of good stuff as an adult.	9	edfka7d
How are you all losing weight post-shelf crashing? I was shoveling ice cream while listening to Year Of Polygamy 😩😭😭😭🍧	7	eec1k0w
Cut out the middle man! Be oppressed directly by your corporate overlords!	27	edomfst
Thank you for the references!	15	ee8i0gw
I did it. Lol.	1	edawooh
I realised hatred does only more of self damage. Over time even the hatred fades.	22	edgg9sf
Yeah for sure, they're too smart to go to class anyway, they've got time.	0,27	ee8pz9o
Nice dude, aimheros just what I've used.never heard of kovaaks. Thanks for the tip, I'll give it a try tonight.	15	ee0evmb
Omg I love these things so much	18	eeb5j2f
I do that with my boyfriend. We can room together on school field trips and sleep at each other’s houses without suspicion. I love it	18	ed4tq85
I feel like I already knew, I just needed to have someone else tell me to really open up my eyes. Thank you for your comment	15	ee3s3b1
Beautiful yet sad that his relationship ended in ‘45 the same way most of mine do...with cheating	25	edxso3y
This is what makes this sub so valuable, crazy and fun.	1,17	eefm9hp
I thought archer was like the machine from person of interest. An AI that watches everything and stops crime in some way or deters it.	27	eey34oz
Real class A asshole there	2	eegslli
Thank you Dad, very cool!	15	eemeuys
This was funny the first time, now this jokes been beaten to death so badly.	1	edaczwj
Thanks. I appreciate that. At least I know I’m not the only one.	0,15	efg25kp
I think that toxic masculinity refers to toxic behavior that has misogynistic undertones.	27	ee50gir
"Wow, was I in for a long time, because it my parents never did stuff like that in your ""gift""."	27	ed7xrlm
I already called the county I got married in trying to find out about it but they had nothing on either of us about a divorce.. Im so anxious.	19	efan4tt
Lol love that [NAME] and [NAME] are both [NAME]. And [NAME] as [NAME] is best choice. Should have brought puddy in though. Hah	1	ee2iuym
Yeah. I heard that in my head aswell doing the last argument, and found myself back here posting. 	22	efhapwj
Valid. I think we mentioned in the Discord that exact point the other day.	4,27	ee6l1sc
Redditors are racist.	27	eczq5fp
I was always in awe of just how stunning she was. She doesn't photograph well though, it's a shame. 	12	ee8lhc2
You’re an awful troll...	11	eeo7rbv
Yes. Or had trouble finding someone to sit by. Not many were interested in me.	27	ef6d03u
I'm happy that you got the [NAME] back, some people just don't have respect for others and think that they and their kids deserve everything	17	ef2b63d
Buddy... Are you ok? Is there a teacher at your school that's strange? Kidding. Nice post as always.	4	eecoe24
I would absolutely claim it and yell that my Auntie was looking for it.	3	edoxqsp
Alright, thanks again	15	eea8ak5
I definitely rushed it. What do you think I missed?	7	eezky46
Yeah, anyone the team has dibs on and even the team's UFA vets can participate in offseason activities. They have to sign an off-season participation agreement.	27	edcvhrs
Great news. Hopefully we can get a PLP that is more representative of the membership.	0,20	eddr7ui
"Read it again. He ""really likes"" her. He never claimed to love her."	27	ed6c58p
Officer [NAME] is the penultimate FA character. Apart from the fact he's attractive of course AAAAAAAAAAAAH	0	eew885s
I'm humble.	27	edrlezd
Is River Rock not just filtered tap water?	27	eeatts5
If only we were in that conference room to hear the answer!	27	edfucz5
Oh I wish that was how everyone thought. Unfortunately it's not.	22	ef18jc3
Given the politics of the time that wasn't unreasonable	27	eddhksg
I came in like a wrecking ball...	27	edmtzrg
Oh [NAME], oh no, no no no	26	ef10bq0
No one does	10,27	een9obk
That's how I used to feel but contracting oneitis added a heaping shitpile of loneliness and agony on top	9	eextepw
Nah, you should have just listened when I tried to warn you about fake 	9	eeeobwh
I understand it but still can't ask questions. I am too afraid	14	ef8v7pm
[NAME] yer fucked.	3	edz2837
I don’t go out that way much but even [NAME] is killer if it’s slippy out.	10	eeqxjvo
It's just projection..they can't take a joke so they think no one else can either.	27	eds7fql
Sexual frustration.	2	eeslyec
Because he's attractive. Hence [NAME] come out in droves to defend him despite the fact he's a horrid asshole.	2	eduyl4n
There was no Last Airbender movie. [NAME] has invited you to Lake Laogai.	27	eekd4qy
Unfortunately it isn’t available in my location. But thank you for trying to help me ☺️	15	edem6j1
Went on a date with a guy getting paid to do a study that took brain scans while he was tripping on acid	27	ef873rt
Check the frame (FPS) limit option in the advanced graphic options menu.	27	ed4oi51
Congrats dude! Can you give us a quick tl;dw?	0,7,15	eehn8i1
Super cool to see	0	ed7uin2
Yeah I love can ox, but they should stay in small indoor venues or something. Their music is better for that anyway. Cold vein is classic	27	eeb682h
sorry mr brolobo	24	edb1irc
Will do tonight!	4	edd7pbk
Complain about it.	27	eeipyaj
"Ahhh, the old ""if you don't vote the way I do, you're a big dumb idiot"" gambit. "	3,11	ef6s2ne
Yea that makes sense. It seems like just another ploy for attention on her end 🤷‍♀️	4	ef4k693
I just looked for this sub so I could comment on how great he is.	0,4	ef4awhr
The only one to really be sad about losing is [NAME] tbh	25,27	edsu71o
Stupid play.	3	eferidt
I’ll just take this as an apology and bid you farewell AM x	24	eddudp2
+1 the only way	27	eeqskv0
You got it, thanks!	4,15	eeh6t6x
I feel that way about [NAME] antis saying [NAME] and [NAME] antis saying [NAME]. But I’m also terrible and laugh every time I see it.	1	ef3cehc
Is that really a thing?	7	ef1011o
sorry im deaf i can’t hear you	24	edy1mfi
Would your 20s have been better?	7	eeqxv0u
If you ever need to talk to some one and just vent to just DM me.	5	ef33opm
I don't know what they say about fools and their money, but I'll gladly pay you to find out 	17	eeesars
I hate beer. But I'll concede the point because others like it. ;)	3	edvhoad
Or he fetishizes about them. You never can tell.	27	edg4u88
So deport the bad guys and let the asylum seekers come in. Sounds like we don’t need a wall anyway.	27	edkaxmv
I think it looks great	0	eeavyn9
[NAME] just has to wait a few hundred years	27	eevw2rl
OP and wife probably have other areas that are private. Sometimes it could be our dreams that even we don't dare speak aloud to ourselves.	22	eed1128
I solo climbed to Master as main DPS with 60hz. It really doesnt matter.	10	edmx3pz
You’re killing me. Let a brotha know next time lol	1	ef0iuej
Going small here... interesting	7	ed4ceot
oh thank you! im relatively new-ish and did not know that	15	edu6bon
this meme is so old it whipped me back into 2011	27	ef26qi7
that's how powell should play. now, let's will wes' post-ups out of existence	27	eduxg4q
Cool story bro	0	eeqdmln
SOOOOO TRUE!!	4	edjwcqi
Unfortunately 22tcm is not standardized, as long as it's Armscor exclusive it's irrelevant.	10	edbhzf7
I'm sorry for your loss. From the picture it looks like he had a great life if that helps	25	edu77h4
He's completely lost any power or rip moves.	27	ed35x5q
And you're competing for moral high ground on the internet. Hope you feel accomplished.	20	eec49g9
That sounds wonderful.	17	eee3gg5
people voted for a wall it's a democracy. you don't always get what you want	4,9	ee31pj1
Holy panel gaps, [NAME]!	27	efcjb18
We've got a long way to go and a short time to get there. Literally like an hour.	27	eeta9rp
This comment was made 2 years ago.	27	ede8wv2
I also got this on a different account, but I have no clue why! Does anyone know?	6	edyggtv
SS: Collapse of the west, and re-birth, all in a beautiful video.	0	eekajmn
Should've gotten a prenup.	27	edrmgyd
i still remember by my first dodger game in 2001	27	eebvvim
Ah man this video has everything, drama, action, a tiddy poppin out	0	ee5knqu
If the voiceover has to justify that butter gives the food good flavor, you know they've been adding *a lot* of butter. 	27	ed4e5kj
I met up with a woman who was 49. She reminded me of being old. That isn't attractive. Youth makes you feel alive.	3	eenu3pu
Yeah pretty much. People do change, but never ever do they change because someone else demands it from them.	4,22	eeznwjm
The internet never disappoints.	9,17	edmbo6x
Do you even TRY TRY TRY???	7	ee325jq
I'm a cis woman and your wardrobe sounds like like my ideal fall wardrobe!	27	ee5mm6i
"Oh boy.. ""The Beginner's Guide"" game on steam had me messed up for a couple days.."	3	eemkrhu
Ooof. I have a hard time trusting asexuals who declare this information mid elationship.	3	eeswcjb
Have you heard of the [NAME].	27	ed1ufuw
One of the comments on that video: “Cat: I’ve waited far too long.” Hahaha	1	edo7k1s
Good mythical morning. Hope you get better soon	5,20	efe7v2z
That matress smashing into his head at the end just kills me	27	ef1y2w2
my mom caught be masturbating to dominatrix porn (i was bored of vanilla shit) LOL But porn addiction is bad because it can stop you from approaching women etc	1	eev5l0o
Isn't it awesome. And then they get praised for their problem solving skills and dedication.	0	edtud1k
He’s not going anywhere	27	efgbx6t
I had a second date yesterday with such bad breath! I gave him a pass on the first date because we met online.	27	edz4j9p
I love [NAME]	18	edgcdnb
What a strange song	27	ed72dam
I brought my love a cherrrryyyyy....	18	edrbymf
Is it that common? Here on the tube on London there is barely room to breathe let alone spin so I guess we avoid this kind of crap	7	eeqstmt
I don't see whats's the issue here Edit: spelling	27	ef4oce3
but that’s exactly my point lol you get better at those things, the scary factor affecting skill learning becomes smaller and smaller	1,27	edr4oug
I wonder if the formal letter from the psychiatrist will help if cops just decide to shoot her first :(	26	edq5zue
Yup. Hysterical bonding from ultimatums. Remember that time ultimatums created lust and desire...........?	7	eeyd7wy
Sorry, but getting shot at causes an almost instinctive natural reflexive reaction to shoot back. I guess I'm just weird like that. 	24	eecx0gi
Well damn I guess I timed this post pretty well lol	1	ee98n3c
When you gatekeep a community, you ultimately hurt it.	27	ef19t5w
Lmfao I'm not here to Google easy shit for morons.	3	edja4ur
I believe so	4,20	ed5129w
Love you, [NAME]	18	edutvlf
Didn't seem patronising to me.. just kids being kids when confronted with a guy banging on a drum.	27	eek3pju
Only all the time. As of a few years ago it’s been impossible for me to do it, which is discomforting to say the least.	3	eeyxpv3
There were rumors for a long time to work out and I ended up making it smaller.	9,27	ee8gra9
It’s the comment about smelling her that makes it pure cringe.	14	ee6ubza
If you all keep nagging me with this question I will turn this car around and then *no one’s* getting to watch the trailer.	3	ef8mk11
My mom goes through a 12 pack a day. That’s an alcoholic.	27	eff6cnn
One of my cats always eats the other ones food. I never noticed it until he was obese. I'm not gonna make that mistake again.	22	eeubqp4
Good for you!	0	ed0y6l2
Except when you get put against the same 6 stack 5 times in a row and they smash you every time... was not a good time	27	ee1jhf2
Happy to hear this exciting news. Congratulations on your fun-filled morning.	0,13	ede72f2
I figured that’s a British thing. Is that not a British thing?	27	edkiv0e
oh no, I didn’t mean one of my boyfriends haha, I meant one of his things. we’re not in an open relationship	1	ef2jd2r
It’s all good man, I missed [NAME] too. I REALLY hope we get another dream sequence with him in EP4. 	17,20,25	ee65bd8
Lol for some reason this made me snort hard. Thank you.	1,15	ef4prdf
"*anti-racist. ""Racist"" is just another slur for 'white', like 'cracker' . Trying to make it work in any other way rings hollow."	27	eekfl4d
That's the kind of person who'd fuck up making you a plain hamburger. That sack o' shit needs to be sent through a wood chipper.	3	ef5dcm0
NCAA is a poor barometer for scoring. [NAME] was leading scorer in all NCAA for like 3 years running. Not even sure he got drafted.	9	edcmkkf
Or that's just another terrible problem with the template	3	edgbxqg
