This is so powerful.	0	eeb4jo5
Oh, THAT. Yes I agree actually, I found that part rather malicious.	4	eetsnku
This isn't a meme its a cry for help	10,25	ed2necv
Sending hugs and good vibes ❤️	5,18	eeo3o4x
80k/month? Damn. I need to become a Union Square store	7	efaud9t
It says so in the bottom right corner :)	27	ed60vun
Imagine discovering time travel and you’re just like “hi, im famous now” 	27	eeiip4r
why cant gifs not have sound? thats for youtubes are for.	7	ee9uxjt
That's an unexpected pair of fighters.	26	efeue2m
thank you for this, i feel less alone now. i’m glad you overshare on this stupid website :)	15,17	edoo7ro
I know of two people who did the Keto and some intermittent eating and got off all meds.	27	ed71rwy
If they’re not gonna get anyone else with that money then I wouldn’t have minded	27	eddxjux
I’d smile back at you	27	edr1o40
>Would I pull my gun if that were happening to me? >absolutely	4	edhagu4
I was hoping this would be a case of r/maliciouscompliance It was close.	20	eeq8don
2nd fav dunk after [NAME] on [NAME]. Still get chills seeing [NAME] go nuts on the bench.	27	ed1ci2g
i would not want to be they guy operating the reloader while 2000RPM of 30mm shells are firing	10	eenvuz3
Just hit my 3pl8 squat, been looking forward to this for a long time so really happy I finally got it! Now on to 4	13,17	ee6zmsb
Well now I am super pumped! [NAME] I hope AA doesn’t disappoint us	20	eeui1et
Nursing school is wrong on that. Still, sickle cell is really, legitimately painful. Give the Dilaudid.	27	edguuyk
Omg just drink some water then bro lol	1	eczs5qj
Where does this one person every 67 hours statistic come from?	6	edgs59p
FANTASTIC!! I didn't know what hole to look at. Geysers!	0,6	eee61pk
I want a [NAME] podcast. Doesn't have to be weekly, just once in a while let him ramble about something	27	eeuv7ao
Love the whole lebatard community but she has the most confidence speaking and it shows up on all the shows she does	0,4,18	ef0eurr
My girlfriend hates it when I'm playing videogames, so there are definitely some women, especially from certain cultures that think video games are just for kids. 	27	eef95bf
Sticking his tongue out.... ugh	11	ef56vi1
That seems crazy that you can't hit higher frame rates. I can hit 80fps consistent with a 1080. Something weird is going on here.	9	ed53zzb
The prequels garbage? It’s treason, then.	27	edo8yph
>continually push that as fact I never once did. I responded to the corrected statistic that YOU provided.	27	ed8vvl5
That's so horrible. I am so sorry that you had to endure that abuse. I hope that you have a bed that you love now.	5,24	eezngwz
I really appreciate you saying that And yes he is the cutest	0,15	eczbvy8
or just more competent.	27	ed5s7s6
The actress died before season 1 aired so that’s literally impossible since [NAME] didn’t betray until season 2	27	ede96bz
Clearly. Sometimes, this woman baffles me with her stupidity 	6,27	ee6r1f0
You're thinking of [NAME]. [NAME] been a senator since 2009 and is up for reelection in 2020	27	ef42ip2
"""And, over here Sir we have the automatic folding model. It is quite remarkable."""	0	eczrr0o
Omg this is awesome. What a witch, I’m so glad they escorted her out. 	0,17	efcx6fq
They just dont want to go to school. Source:am high schooler who would skip school at any chance given	27	eeuqgh9
I would be more offended to be served cereal on a plate.	3	edpxqi6
This conspiracy theory that entertainment scandals break as distractions makes more sense to me every year	27	efdar6m
That motto is awesome!	0	efb0ae6
Anyone else see her 10 year challenge post today or yesterday. I'm so shocked she wouldn't pick this picture.	26	eepk19l
Oh [NAME] lol the cringe is palpable	1	edeukmj
That’s what I said.	27	ef7wk5t
Not probable, I study in the best university in my country, I don't want to stop at all	0	ee7zjtx
The hardship of having the future meet the present. (or something)	27	edgtfh0
Dont forget [NAME]. He was a reliever converted to starter. Hes got some ridiculous pitches just needs to work on consistancy	3,10	eeaxnmo
Hi furious, I'm dad!	27	ee5yllc
Shucks, that's 11am for me. I might drop in one day when I don't have work. Thanks!	15	ef9mrbo
So everyone elses advice is invalid? Elaborate.	27	eeibpop
I shouldn't be tanking this much rating after even a year bro. You don't understand how bad it feels to be in this garbage elo.	3	ee1v3mc
Meth is a hell of a drug.	2	ed7t6le
[NAME] can't create on his own and has no in between game, [NAME] is too inconsistent at it.	27	eet6qhr
"I just want to note that ""Live Photo"" is something how I'd expect [NAME] describe a video."	8	ee48clz
This submission was removed for breaking rule 7. This topic has already been posted, please search.	27	ee51sz6
I'm glad none of you are GM	17	edij11m
finally, a game to watch	27	ef6z0k2
That's hilarious, and a much better way to play doctor than some of the kids I've heard of! :)	1	edcqldi
What is your current relationship? From my experience women younger than 20 always look for older(0-3 years) men.	27	ed1f8vx
Why aren’t we putting guys in for garbage time?	6	edoyo8y
"""IT'S GET YOUR GAME ON! SAY IT RIGHT!"""	2	edvz8it
This is so sweet 🖤	4	ef74fn4
Going from [NAME] to [NAME] on the PP is like going from tenderloin to convenience store hotdogs	3	eds2252
That wasn't very incredibilis of you.	27	eemeq8n
The guy that waived a future hall of famer. Hard to get away from that decision.	25	eefr4mw
I'm sorry. On the plus side, your toilet joke made me laugh really hard. Lol. Thanks	1,15	edfz7hu
>Israel is literally an apartheid state It's literally not and the proliferation of that accusation is based on ignorance and simplistic understanding.	27	efgz96k
Thanks for posting that. I’d thought that I had seen all the Rice footage in existence. Good stuff.	15	eejfgqw
Another LA teacher here. They get posted around March. Make sure you start building up your portfolio now. Best of luck!	27	ed70sm9
I already know [NAME] sucks... He will be gone in 2 years but the shitty press that you support being like [NAME] will still be here. Congrats on supporting propaganda	2,10	ee5ubym
BPA not fit especially when we dont have a good team	10	edm4r5f
I'm sorry, do people NOT listen to [NAME] 9th while driving?	15	ed3ovpu
Haha I don't know where you are, but I feel you	5	eeyjamp
What happened??	27	ef2748i
It's not like UK monetary policy massively diverges from the Euro	10	efcsu2b
They’re well on track to getting that superpower by 2020 slot	13	eff25k0
Ok sure that’s a nice unfounded opinion you’ve got there. Unless you’ve been in one in which case wow sorry	10	edo0dgo
It's a bug, don't listen to the pets people. Everyone is just a little to excited.	27	eda92l2
Your response is truly one of the most amazing ones I’ve seen.	0	ee9r6qm
Amazing shitpost.	0,4	ed6kk1f
I heard about that too	4,22	edy1d2n
No, no I'm not.	10,27	ef0m6zi
Ill take condoms and council tax over dying in horrible pain from typhoid but each to there own.	8,11	edkmxax
It's absolutely 100% abuse, as others have said you need to get the hell away from him.	10	ee9frq0
As you hint at, I think it's more jealousy than prudishness.	27	edt51jc
Couldn’t agree more, and glad there are folks in the media that recognize this	10,17	edr8q28
that's not scarcity its desperation and prioritizing looks over everything else	10	edh01o9
This makes so much sense. Seems she has been icing me. Time to call it quits	22	edkl1yg
Of course. I'm curious as to why you'd think it was a bad sign?	7	ef162u1
LOL that would be way better	1	ee7wqoz
[NAME] is my fav skater of all time he's sick	0	eeht7y0
And go where? That McDonalds 😂	7	ed1u2h7
God damn I miss this game!	25	eeihrhi
Right but even without the FPTA surely we could have found ourselves in the same situation from a legal perspective?	7	ee9c7xk
I’m surprised it was uploaded today, especially since he uploaded a video just a few hours ago	26	eetmqcw
Look at her all grown up 😍beautiful.	0,22	ef1571z
Best decision of your life.	0	ef65n0e
Yes. And I wish people weren't so afraid to say it as many times as necessary.	8	ee9nvvg
The most my dad did to help with the housework in 35+ years of their marriage was to lift his legs while mum vacuums around the couch	2,22	eevhzdx
I miss [NAME] and [NAME]. :(	9,25	edkvpct
"You offered her the wrong ""services"" /s (obviously I hope)"	3	edo0rxr
Ha. She cried because you influenced it.	3	edveb2k
Fair enough. You know him better than any of us do.	4	edppitt
Be adult Pay taxes to govt Be deemed incompetent by people with different views Feels bad	25	ef83wkk
But not to the folks screwing him at the gas department.	10	ed2azak
Stop spraying chemicals daily in the sky.	2,10	edtfria
There is no coming back from this. Move to Africa, never talk to your family or friends again. Also throw away your phone. 	27	eenan17
Well I just love it when my Squad Leader puts the order on the Opponent's starting flag for the whole round while we lose everything else.	18	edgiibo
It's crazy I don't get where their finding them	6,13	efc2ja9
Happy New Year everyone! It’s 11:42 in CA 2019’s almost here	13	ed016ly
Well come on out here, lil buddy. 	27	ee1lyx1
In my favourite clubs pretty much always. The people there are lovely. In any other club very rarely.	0,18	ed7gkik
Well you came to the right place	4	eem7ej9
Cool. Hope they intended to clean it up but this kind human beat them to it.	20	edco2wn
I love how he does the [NAME] shirt-pull because he is captain.	18	ee8t4u3
"Yeah that's about what I found. Not that specific page but I got into ""My Profile"" "	13	edofyho
Damn, that's dark	14,19	ef25gli
Umm... educated people who think that killing a fetus after viability is abhorrent?	7	efgjyz2
Damn you, [NAME]. I’m a woman and yours are bigger than mine. It’s not fair!	3	edugeo7
is there a wikihow for that? edit: [of fucking course there is]	7	ef9rq49
Haha. Yeah there is a vaccination now. When I was a kid my parents did the same thing. It hadn’t been developed yet.	1	ee09sr9
I’m a millennial and my mortgage payment only takes about 1/5 of my after tax earnings in a month. Feels so good.	0,17	eeb5ige
I couldn't think of a better definition.	27	ee5j5c1
YES!!!! I will never understand why some post rants complaining that they cant make $$ off another persons hard work.	4,27	eezksmq
This is the most early 2000s thing ever. I love it.	18	ed9xp77
When everyone is lying who are you supposed to believe ?	3	eexyl4e
Sure. The subject of her video was certainly creepy and obnoxious.	4	eean4lm
I can feel my left knee getting sore now	22,27	ed06qes
But people already know I'm weird.	3,27	ediiwnp
It can be uncomfortable to be honest but after a while you both find your sleeping positions.	27	ed3kn8e
BJJ guy isn't wrong, he's just being waaay too sincere with somebody who's taking the piss.	27	edb7f5k
Even weirder way to spell [NAME].	11,27	ef5wsqt
Win the information war, freedom fighter.	27	eezffba
Need a big lead and we have [NAME] shoot 3s and [NAME] waiting for the rebound!	27	efeqdlc
best: buy flowers because you want to make you SO smile worst: keep going because love is what matters not the issues	18	eepije6
>Popular >Secret Choose one.	27	ef7spto
Very well said.	0	ed4bwcs
Wow! How does it know?	0,7	eeqxhud
> Is it weird to have more sympathy for animals than humans? It's frighteningly common, so not *weird*, but it's definitely sad	6,25	ed2zyfk
I don't even find her that loud or that wild I think he's just no fun.	10	eex2oi3
noob spam haha	1	ef1dcfc
Stomping the Titans before Christmas in 2012. I got to watch nearly every playmaker do something big, and got to razz my Titans fan buddy all day. 	13	eebciyt
DEAD DUCK INSIDE DO NOT EAT. Well, I’m not sure what I expected. 	2,6	ee30gy8
This is wonderful. Hope to have him and that newly a Dad joy back on ice as soon as he's ready.	0	edctm6s
Style of play is overrated. We spent half of the season sticking to a style of play. We should play what gives wins.	4	ee1dowq
Look at downvote_me_moreYOLO's posting history. Looks like a UofT student from the GTA. Judge the source and throttle your anger accordingly.	3	efa9v6r
Really? Wow I was sure they were huh. Even still I feel like he needs berserker light damage for that sword	22,26	edt50jp
[NAME] was the [NAME] of the [NAME] years. Didn't realise he was still about.	22	edf126f
It’s grandmas house. His house is a tip	27	ef1479j
Character and emotions are not the reigning champion one year earlier...	10	eedm0d0
You shut your mouth. shut it right now. *sobbing uncontrollably*	2	efewbxf
I have his signature on my jersey. Lined up at Canadian Tire for it when I was younger. Happy retirement!	17	efgq66d
No, [NAME] is dating [NAME]	27	eehde47
Of course. It would mean you owe them an unspecified favor in the future. That would be horrible.	3,14	edmel1r
Because real socialism is fawning over rich capitalists, and the more you fawn the more socialister it is?	27	edrrj7x
That’s what I meant, sorry bout that. Never fold AKs pre 	24	eeacw2q
The 12 days of Christmas is a bizarre song. Don't use it as a gift giving guide, you crazy idiots.	3	edp9pt2
Didn't even get a chuckle out of me. I guess its just too high brow for my dumb brain.	12	eehstl4
No. Can’t get off to my own sex.	10	eewmg4r
lol, you dieded	1	efg47mv
No one to blame here, bad luck is what it is.	25	ee80lw0
Why are you sorry for your grandma? She did what she had to do in order to get what she had paid for.	24	eedz75s
He’s a grumpy boyo	27	edqvuqx
Excellent summary.	0	efedv9k
Do you want us to return to mediocrity? Why even put that idea out there, man? Trading away our franchise player like that.	27	ef6gwca
And you can amend a tax return. She can’t amend a terrible life choice like that.	10	eewk8z1
Oh they can make numbers up too , good idea. Astroturfing starwars, this is the worst timeline.	0	ed8tmu6
Do you have any relatives who could support you?	7	edgwvoz
What do you mean? It would be the same code for every system?	6,7,27	eegfaxf
Don't get down. You have only ruined it with that one person.	27	eeye9u5
So this offer is only open to isis? do you need to show some form of id to get the money.	27	eek1crn
She has at least 12 elbows and all of them are happy. You get it gurl	17	eda8l2f
Lol i control your life gooferton btw open your chatbox	1	eeygt5v
Watch your back u/Youareapooptard, [NAME] might hunt you down and burn you alive for that relatively minor insult	2	eemt486
Because he thought he could do it, but he couldn't make himself pull the trigger.	27	eeciv20
she usually sits below the bathroom sink like a fuckin weirdo between 9-11 pm but she'll be free after.	11	edloxw1
Thanks for the warning, I'll probably look into it anyway, but I appreciate you telling me that!	15	eevsiyr
Lol he said it was the driver's fault and everyone called him out.	1	edn6y20
Some say [NAME] is still trapped to this day in those abs.	27	edut9ol
That’s adorable! I hope they stick with it!	0	eefzkr5
You’re good, no worries	0	edy17z5
yeah, I've had the hardest time letting go of my exes. The last straw was when I found out they cheated.	27	edjsn4g
what in the actual fuck. why are they still driving?!?!??!!?! Love the kindness of the young dudes tho	0	efdsukh
I don’t make the rules, man, I just blindly follow them like a sheep	12	ee3ei52
OMG this is gaming history in the making. Lol I can't w8!	13,26	ee2gx3e
It's genuinely disorientating to witness it.	6	eev3y9m
this would work!!	20	ed6pe46
RIP [NAME], you were a sweet girl. It's been over 10 years but I still miss you.	16,25	edjhszz
He has become that which he swore to destroy!	2	ed0hx3c
Thank god, you're right. At least this idiocy didn't stick around long.	15	eerx6td
People working in hospitals are seriously under appreciated.	0	efeh2gd
Thanks for sharing. I'm afraid I will start to squint, this way. Not sure if it's the case. 	15	edrrpw8
The problem I had was them painting the majority of men under this flag and then saying some are changing. Most men are not predators.	27	eehpxei
An ex-friend of mine proclaimed than anyone who speaks of being raped is a horrible, unethical human being.	2,3	ef3uof8
I took a picture of the sunrise this morning too. Just north of Austin. It was very pretty today.	0	edoft8i
Ooook, time to calm down now.	27	edzh1lg
I don't like [NAME] this season but she's always been a favorite before. Am I the only one? She has an edge that seems unlikable	10	eegko8e
Same cinematographer, [NAME]. He's incredible	0	ef22xix
you can use your inhuman orang-utan strength to tear them from limb to lim thats an option	4	efefhmi
This is a serious question. Are you glad they told you?	7	ef774oq
Or, you know, imagine just poking some fun at the endless title speculation threads.	27	eedqu76
[NAME] BREAK THE GAME. WHY HAVE YOU GIVEN ALL THE KILLERS A FUCKTON OF THEM. ITS SO DAMN STUPID.	2	ed3tqhn
I mean, it could work. I might be enticed by a slightly less ugly lady. 	27	efeypwi
I want to hug both of them.	5,18	ednru70
Safety Dance in Naxxramas, WOTLK. My favorite boss fight to date	18	eegah1f
The ideal is not to have hope but to act like you do. But if you must chose, pick the former.	27	eda19fj
I think this title is biased. It groups all media improperly.	2,3	eeuh8ox
I always walked in the grass, man. Am I weird?	7	eda8966
Not that surprising, but *very* exciting to see! Here’s hoping Syria reclaims its place as a major regional industrial and commercial center!	13,20	ed9b5y7
the worse part is you might be crazy yourself and have no idea!	10	ee37q3g
I love and stan Manila , I always will. BUT the fan base worshipping the ground she walks on is getting so irritating ngl	3,18	eekrkug
No thanks, I would prefer to not get infested with malware. 	10	eetlbli
How many kids do you see? xıs :ɹǝʍsuɐ	7	ee6f3ip
Was that an inglorious basterds quote in there ?	7	ed0dn2k
Sounds like he dodged a bullet. You’re kinda dumb.	3	eejrwhw
It's a lot of projection. Pretty much anything they point fingers at others for, is something they're guilty of.	27	eeuomm8
Doing [NAME] work.	27	edfqydm
To each according to their needs... Except entitled parents, who need everything.	27	ef58l4l
Hate Hate Hate, feels so good.	1	edisuzq
Drink the kool-aid! Lol	1	eefzxt7
Idk if I skimmed over it 3 times or what, it doesn't say why he did it. But I guess we'll never know?	27	eedgwc9
I don’t see anything awful on her. She’s old. That’s it.	10	ef27aym
Man I love how venezuela is a dictatorship when it has 4.5 times less prisoners per capita than the US	18	efadiyw
#OMG TERRIFYING!!!!	14	ee36jp2
My 1 year old ate TWENTY TWO broccoli tots for lunch. And he still wanted a cookie afterwards. Like...what?!	26	eevlkwa
Pedes hate him!	27	ed0ykrx
Clean it up	27	eesvp0i
I take it they don’t train high risk traffic stops in Arkansas?	27	eczpwqw
He has utterly squandered his time since leaving office. For those of us trying to champion his legacy it's a perpetual headache.	27	ees8t9t
You sound like someone who has never banged a BPD girl.	27	eeb90c2
I absolutely hate the guy. Can't stand him. But we live in country with laws and he broke none. I think lynch mobs are more gross	2,3,11	edhh0xw
I agree. More stupid ideas by ''the adults in the room''.	3,4	edb3e9o
Then you should probably get out more.	20	ef6us1e
Instinct and Intellect are opposites, never said they were the same	10,27	ee2mcq9
How do you deal with alerts coming up on your phone? I guess you can just turn them off?	6,7	ede8u8i
Holy fuck, no wonder the turtle beat the hare	27	ef1hiqb
This is so, so great.	0	edv8jvw
Being bullied is what taught me I wasn't wanted anywhere.	10	eenfk6d
Yeah what kind of loser writes songs about girls	6	eed35sz
Same, it was such a wholesome way to smite the person!	27	eejftmd
I just realized what she reminds me of with that tongue; a frog!	22	efes66w
My childhood horse died due to twisted intestines. Very traumatizing, since he crawled over and put his head in my lap at the end.	25	efe7q93
6 year old me def couldve said this. 6 year old me LIVED for dinosaurs.	27	ed7yr5c
That looked HARD	27	eet9hlv
Old people sure do love their cable news history	18	edbdm8p
If you don’t include AZ in your 3, you’re wrong. 	10	edboboe
That unfortunately still doesn’t stop the thoughts or really address any issue I raised in my post. thanks for your concern though mate. I appreciate it	0,15	ef7w8xr
So incredibly sweet!	0	edlx6rk
No. Making [NAME] a legend would be the nail in the arrowverse coffin	27	ee8hfic
But that's classified under the DSM-5 as a mental disorder.	27	ee2zswz
I predict one of them is going to be complete garbage and the other one gonna be competent with some critics calling it better than the original.	22	ee1z1qc
Awesome, great to see people coming together for peer to peer cash!	0	ed4vptx
I have no idea how we are down by ONLY 13. Its truly a miracle.	26	ee61x8k
Aww this made me tear up! Please keep posting your poems, they are so special ♥️	18	ee2jg36
If only someone would love the septuple-PhD in the galaxy for her mind.lol	1	eediukq
Oh wow I didn’t know they put out the entire song. Thank you! Have an upvote.	15	ee13pha
I like it I just wish he’d drop the m and apostrophe	8	edrmocj
I see.. so people are just guessing?	27	ee0plfh
Why would anyone forget how dominant he is? Lmao Oh yea we suck.	2,9	ees19dc
Omg yes. Could you imagine? Pepperoni rolls, peach schnapps in a mason jar and beer cheese at dinner parties. Love it	18	efc8kjl
You can't demand historical accuracy 'at all' then. It's logical fallacy.	2	edmqmsn
Puts me to sleep. If I want to watch a bunch of dummies be dysfunctional and commit crimes I'll watch Always Sunny.	27	eet1qnr
I love artic blitz personally	18	eenbwjz
It’s more of a vibe tbh I love playboi carti as much as I love [NAME]	18	ed7dwbh
Your dad is awesome	0	eeli19e
Not to assume things here but why would you gas yourself over [NAME], kid is a fucking monster	3	edi44ur
*I ‘ m m i x e d* *h e l p*	27	ee3fu49
Then go in loud. I did that my first playthrough	21	eelhchz
It's the worst when it's something you are passionate about	11	edgd1ae
I think it quite apparent I was being satirical in saying Mississippi.	17,27	ef4c0wr
Hahha i agree but i still want him to say sorry.	4	edxfdvz
Oh hi [NAME]	13	eezybgx
Have them put out a Linux client and I'll be happy to give them a try.	4	edo6bnp
NOW THIS IS SOMETHING I CAN GET BEHIND	27	edbu24x
I think so. It’s one of my favorite [NAME] characters and a fun trilogy. At that price point I think it’s really worth it	0	eds3253
Next time just tell her she paid for a Venti so that’s what she is getting😂	27	edyfvuq
Thanks I needed that.	15	eef9xid
Always wanted to try [NAME], I'll add her to my list.	8	ee67ej2
I've been trying to as well, but the game is so scary :/	14	efg90px
Or they freak out if it’s “not the right sub” for your post. Like calm down	27	edpbhn9
Just a suggestion.	27	eedb9nb
what i dont understand is WHY the media hasn't yet picked up this story?? Especially with [NAME] in the zeitgeist.	6	eesobea
Thanks for the reply. They are saying the engine issue is in cold weather. I live in NY. Does it get cold where you live?	15	ef284g2
Oh yeah that	27	eexdkbj
Oh god [NAME] has a fucking gun oh fuck	26	ef0lwp4
He ain’t lying. I’ve seen the way he eats tacos!	27	ed2c8a9
Interesting. I’m not a troll.But if it makes you feel better...	5	ef7h94p
I was Isla Vista, beautiful and terrible place	0,6	efdkeiw
If charity worked, everyone in the world would be fed and healthy in this precise moment. Also, how are you going to enact basic income without social institutions?	7	eepg6fx
I dont mind these people dying, what bothers me is that some random bystander could be smashed by this guy should he fall	25	ef4lrqf
Great setup.	0	eemk7fb
Did either of those places declare independence out of the blue? No.	6	ed3fatr
I pray that I won't have to change my clothes.	27	ef871vf
[NAME] damit you got me! Take your upvote sir!	3	edahy01
I used to do the same exact thing! Now I love the fat on my steak and watching them cut it off in japanese restaurants makes me sad.	18,25	eeaiy0n
Nothing good can come from knowing. Just let it go and focus on the relationship in front of you	20	eczlhjo
I thinks he's the leader of one those Turkish backed rebel groups. He was accused of raping the wife of one his soldiers and screwing prostitutes.	27	eewnoyj
This is a hige step! Congratulations, and looking forward to hearing about your recovery. You have a whole new free life to look forward to :)	0,5,15	eeb8s50
Haha. Thank you	1,15	efbe3ir
Small group of friends either outside or at home listening to good music would be ideal for me. Maybe even one sober person to drive our high asses around	0,4,20	ee6kojr
Given that you're not a conservative and this isn't a debate sub, how about you just get the hell out and stay out.	2,3	ee0f6ba
Np just passing it forward from another comment haha. Love the sudden silence in this video. Love the look on everyone’s faces.	1,18	eeuwrtg
Beer bottles and his ex's old stuff. Because if country music has taught me anything its that all that exists is a gun, alchohol and some girl you lost. 	22	edjl379
ah fuck. From xbox to zullily? seriously!?	7	eebd74b
Lmk if u come across anything	27	eeu0pv8
Your reading skills are unparalleled	0	ef7jm7c
40k concurrent viewers on twitch and 100,000s of views on multiple YouTube vids would argue your point 	27	ed4yzc1
Don't worry, [NAME] can't even pronounce Kombucha.	27	ed4pnnp
Can we also get some love for torb? Give his turret deployment the same treatment while we're at it.	27	ee5e796
Yeah, this has been posted here before, but it's a great video. I have it saved to a YT playlist for repeated viewings and lols	0	edukmpa
This literally broke my heart	9	eesjsfv
All my hugs to you. She will have a peaceful end surrounded by people who she loves so much.	5,18	eedwbky
TB12 is the greatest	0	eelmsb9
