[NAME] is nowhere close to the worst linebacker in the league.	3	edngoc6
But come on babe, you know you want me babe...l.o.l. JK Babe ;)	18	ef0fz6d
Great sign! We’ll get them next year!!	0	eeahjaj
I’m going to be here instead of the chat room personally	27	ed48t1k
What u/Goyteamsix said.	27	edivs7i
Ah, thank you	15	eekb15n
With a lot of severe brain damage after being beat back to life with an ugly stick.	25	effffov
Thanks for the explanation! And lol yeah that’s fair - ‘rag’ isn’t exactly the flashiest of terms!	15	eeoginx
I need help with corsets but otherwise would be mortified to need help for every day clothes.	8	eedjzv6
And maybe you can divert her physical touch to something like holding hands, or putting your arm around her while sitting on the couch. 	27	ef7n25x
The joys of being raised by a child psychologist... Lab rat childhood...	27	eeyjibc
Isn't this the plot of the show YOU on netflix? Be careful lmao.	5,7	eeuv5iu
they were very hot for me half way in the year now diamonds seem dead opened 200 packs last week got 1 diamond	27	edyki2a
Deservedly so too. Tbh I think you must be the favourites.	4	eeksg76
So predictable. I bet the bomb is in the puck. Anyway, im exited for the [NAME] and the robot butler cameo.	13	eec5qow
When you feel nervousness, tell yourself it's just excitement. Makes a world of difference. :)	5	ed1qr20
Not really, the save file has nothing to do with the engine.	3	ed69x2w
2016 was also the worst year of my life	3	ef1gsjr
Ah that makes sense, thanks for the quick reply. I'm new to the world of working so I have no idea what's what. 	15	eet6zti
What’s not true, exactly? That population differences affect influence? That politicians know where their voters are and play to those strengths? 	27	ee5q0w4
We really need to sign a new CB now with [NAME] out injured. [NAME] isn't good enough yet.	3,10	eegb3gy
Thank you so much! I love Germany! I was in Berlin 2 years ago for research work.	15,18	ed3gqkb
Actually feminists claim women are superior in every way to men, but that due to male vodoo, men have obtained power over women. 	27	ee4u7ft
felt like that shot by palms was our first in a while	4	edf8z2z
Apparently, his knees aren't as bad as we thought.	27	ee8s5q5
"Nothing makes me exit a video faster ""looking at this made my nipples hard"" 🙄"	0,27	eehyg5b
Sorry but $200 wouldn’t help. Good bye beautiful world!! I’m gonna pray to the ether god to help me :)	0,24	eenyq19
I drive an old car but it is clean and well maintained.	4	ef0oo4c
Damn, time to tweet Young House Love and find out what color they used on the brick...	27	eekfm5s
I'm not even going to read all of that. It is not mindboggling AT ALL. [NAME] is a huge douchebag. The end.	3	ee64x1y
I love that whoever was filming zoomed in knowing what was about to happen. [NAME]	4,27	edul9vk
I just actually listed it for trade haha. I can’t use paypal unfortunately as I’m under 18	1	ef7dfy5
You've got thoughts coming your way my dude	27	edmfl8e
Uh... Yeah... So you reject them.	27	ed3gqxt
I've never been so bored with so much money on the line. I am numb now.	27	edib0iy
You other than the fact one likes little girls and piss/ keeping them as slaves where as [NAME] paid all his girls	27	edu7u78
Wat u been ordering u naughty boy😂	1	edutjoh
I'm excited for them, but I can understand why anyone wouldn't be. They both use the fighting styles of characters who are already in the game	13	ed7ocsf
Big words coming from a guy who only talks about [NAME]	27	eewicfv
Ain't that the truth. It has turned into one old big propaganda/commercial machine.	4	eeyhcid
"""Yeah look"" like a toddler being surprised by his own genitals"	26	ef0g575
[NAME] is the only reason this is a close game	27	ef55nt3
Yeah, just wanted to do it myself. Not gonna though, after the concerted demoralization from commenters. 	4	eduyt4b
No pick and roll, this is a nightmare without [NAME] and with [NAME]	27	ef84q0p
She has naturally chubby cheeks that are set on high cheekbones. I've seen it before and it's not abnormal.	10,22	ef1x3y9
Thank you for highlighting this. No wall. DACA is (almost certainly) fine for another year.	15	eeeu1d1
just test to turn up your bitrate and tell me if it changed or not, would be interesting 	7	edjvb5h
Chickens would definitely die out, sheep might have a small chance at surviving, cows might have a slightly higher chance, but pigs would surely survive.	4	eef5x95
wow thanks for the explanation. it's been like 3 hours and still looks like this	15,22	efdyakc
100%. Do NOT order from there. I have the same story. Don’t post that place on reddit anymore. They’re a scam	3	eevvo56
dae [NAME] IS MOMMY FUCK MY ASS WITH A BACKHOE MOTHER YES GAWD *tongue pop* WHAT A TALENTED ACTRESS BUT ALSO PARENTAL FIGURE	11	ef68izp
A chameleon?	27	ef0ly9i
He insisted on a monogamous break and I agreed.	4	ed8prm1
Leave wet puddles everywhere!	3	ee3qdpy
Please stop using that term.	3	eem0hs3
That’s my luck. Lol	17	efaa36u
Don't the [NAME] generally accept inerrancy? It was the universal position of the Church Fathers.	4	ed44zup
It's a yes or no question so no you did not directly answer it.	6,27	eec3527
It's Shrimpy ( I'm pretty happy with it and the telegram is decently active too	0	effazmg
Cool! Tell me more about yourself---PM me if you're more comfortable.	0	ed3gsox
If he's still blaming [NAME] for his issues, the therapist is doing a bad job.	10,27	ef49khk
Yeah but that post is a day old so OP won't have any chance of getting karma off it, cmmon now	20	edrcsxd
You obviously never seen the MLS playoffs, they make cubo [NAME] look like [NAME].	27	ee2l1rl
I like the hints of purple	18	edtiadm
Good bot.	0	ed9b7yp
Remember: lie, cheat, steal and listen to heavy metal music!	27	edknpit
While you were pickling your okra, i was *pickling my brain* ...waitaminute	27	ef1f2t4
I almost didn't finish this stranger mission because I just *knew* it was going to be bad.	9	ed2wypf
Fucking and being a boy	2	ee3l1vl
Nice try FBI.	0	ef413ri
Very sad. It’s the child I feel for most.	25	ed8xlrr
Ah, as a fanatical supporter of the Alliance I've not done any of the Horde content, thanks for letting me know	15	edh63y7
I thought that I was lagging. yeah, its really bad.	22	eecla22
"Oh, well when I said ""we"" I didn't mean Reddit, lol. My bad if that was unclear."	1	eeoyh5k
What a beautiful moment	0	edy8tvf
[NAME] has made a career out of making strange films.	27	ed3nvdv
I'm new here. Can you help me understand what you mean? I read Jacobin quite a bit.	7	ed12g9u
They weren’t even that good mostly don’t @ me	10	eenaza0
Someone needs to quit horsing around I’ll go home now	27	eff2iok
Oh yes the dreaded Sabres second period:(. I hope they win tonight.	20	efbkv7x
Some rambling paragraphs about what a waste I am and how sorry I am to be a disappointment to those around me and that sort.	9	eeqtqq6
Thanks, but please use the stickied megathread for all discussion and submissions. Repost it over there.	15	ef7nz1j
Never underestimate the stupidity of people	3	ee8jpwz
i swear i've seen this on a poster somewhere at my school, it's awful	11	edxo9iu
Came for the murderino and stayed to say I drive like [NAME] a lot and it’s bad lol	1	edvf9jj
Really surprised I had to come this far down to find this!	26	edd27sn
Please get them into it. Toronto needs a better barn	8,27	eekxis1
I watched that worm fish sauce thing. So gross, disgusting, bleh, NO,NO, and HELL NO!!	11	ee24om2
Common sence isnt that common any more	3,27	ef6v865
... that's... Literally what they did... The fixed the bug, and balanced abathur accordingly. What else do you want?	27	edl53oi
Yeah, my bad	12,22	ee0gbe1
Lovely day we're having.	13	efh5yzs
Wow really? I would think that UK bases would be the last place we'd have protests at.	26	ef6ah65
I'm afraid you have your terms mixed up -	14	ee3uw6u
Fun fact: There are only 2,208 billionaires in the world	1	eeis5o9
I love how defeatist we've all become.	18	ef4t4lb
That actually sounds like it would help, I’m glad it worked for you and I hope you eye is ok now 👁💪🏻	4,17,20	eeswk0k
Goddamn right!	2	ef9eou9
Very sorry for your loss.	16	eedoc1z
He looks especially cute in the glasses.	0	ee0sk10
If one day I have daughters, I want them to be so badass that these kids! Nice to see them enjoying metal! 	17	edju0rv
Dude you’re honestly unhinged. I think you need a break from the internet for today... it’ll do you some good.	4,5	edjdevm
How did Detroit quality for these trade exemptions? By sending 4 guys and acquiring only two in the [NAME] trade?	7	ef9b9jl
I either know you, or know someone who has done the exact same thing. Either way I hope that makes you feel better xD	4,20	eewes8f
This made me soooo uncomfortable yikes	10	ed05f2h
All the time, you just sort of accept it round here. Butt-hurt mombies and bitter regretful daddicts are what I usually chalk it up to.	3	ef4ldo8
They are probably waiting for his harasser to pull a [NAME]. Filthy men.	2	ee33auq
Both directions? They should all be arrested. This will cost the people of Edmonton a lot of time and money. Fuck these pricks.	3	ee074yt
You two are the real heroes	27	efanvlr
Thanks for reminding me of her response video, that was gold	15	eernx2u
The best feeling ever was when class was over and it never got to your turn, so you didnt have to present until the next day	17	eeps9yz
I was petrified...	14	eezwdoa
Wow. Imagine being this stupid. Life must be so hard for you.	26	ee03woe
Are there free vaccines for adults? I thought it was just kids and the elderly?	6,7	ee1ivoo
Spoken like proud slaughter-bound crotch fruit!	3	edij3mg
Nice job on those renders, they look great	0	eey7rr7
You gotta make yourself happy when no one else does	20	edixwr4
Ah yes, my apologies!	25	ee8h54x
I find it gross, especially when it starts to cool. Chicken is great but leave it out of my dip and off my pizza.	0	ee11whh
I killed you in VR once. I loved it.	18	eeaf3a3
Will do!!!! :D Thank you so, so much!!!	15	ef8gl7u
did it work?	7	edtng2b
I got sort of excited and really was hoping it was [NAME]. Obviously it's not.... so yey... mystero.	13	ee4gz7f
HE CAME OUT A WINNER. LOOK AT ALL DAT MONEY FOR DA HOOD. 7-0 WHEN IT COMES TO OP	0	eepodwz
Play dumb all you want, you know what that has to do with it.	3,27	ee5xsw1
So I've just read your whole post. Wow. Your mum is a piece of work.	0,26	ef8o0xv
I love Subnautica. It's so, so terrifying but also beautiful and cool and I can wimp out and put it down any time. 	0	eez1yz1
Who specifically are we gonna sue? The industry! Lol	1	eeqiyt9
That poor girl. She wants to run in the rain and her mean ole momma won't let her. LOL	1	ef6ocxm
Thank you OP, I love you (no homo if you’re a male).	15,18	ee97uhp
Bye, [NAME].	27	eeuv596
You his SO?	6	eeckjux
thank u, thank u	15	efgspui
I remember that. It was a crushing experience that started a whole other level of depression. But hey, maybe things will work out for you. 	9,20,25	efen7m7
Could be between [NAME] and [NAME] based on Twitter followers	27	ef83x54
I love the north east. Can’t say much for the rest though	18	edgifft
yeah, i believe thats the only moving part in the whole device.	20	eemw7v7
They should all be virgins until they're old enough to consent. Obviously this applies to both genders just like drinking laws.	27	eds7vmw
So [NAME] doesn't do the social media anymore? Is the NSP stuff enough without a GG salary now?	6	eeh30n8
Whenever I leave my character in free roam I get an idle notification very quickly. Must have glitched.	4,6	efbri7i
If this is the original Thai (I think) one then I would say it was a pretty good watch. Haven’t watched any other versions	0	ee3dzeq
Just got back from TWC, and they were great! Thank you. 90% they were fried. Will try these others next 	0,15	eeeybmj
Everytime i see a T-Wolves game and i see [NAME] running around with the number 67 jersey on i just laugh	1	edkha17
"I find that even when I wear a hat, I ""look [RELIGION]"" and get the same hate."	3	edq8cab
This gave me PTSD	27	eeayz78
What makes your point of view definitive. In most of Europe everything [NAME] support us seen as extreme right wing	27	ee0cxk0
Australia... Nooooooooooo!	10	efcm05v
This is the most adorable thing I've seen in a long time. I hope the intro went well.	0,20	edrppj5
It's a black cockatoo. They're rare and kind of beautiful to see.	0	effdfdu
Wow you’re cool	0	eeyjwnh
Are you trying to frame me? Let me put it this way: they're all MA'AM!	27	eexnbix
Put that back where it came from or so help me...	3	edr3p2l
Relive the magic. <3 [NAME] & [NAME]	27	ef6v0zm
With the tomahawk through the A? Loved those.	18	eeaj0wg
"> ""Death by Inches"" Title of your sex tape!"	27	edqjfsc
I get migraines too and I’m sooo tired the first two days of my period	25	edq3k72
That makes me super hesitant. I wouldn’t be upset if we end up with him but the last thing this team needs is raw players.	12,20	eekrhho
This post is actually getting me to unsubscribe from this sub. So good job, I guess. You successfully showed me something I hate. Thanks.	3	edanmkj
"I said ""try."" Red wine is a thing for a reason"	27	ee2zuch
Slathered in blue cheese. [NAME] is so jealous.	9	edw17yo
It is January after all. The yard in my house is looking horrific right now - I haven't been out in 4 months!	27	ee42xvl
Let them argue. We've never done anything remotely as bad as MOST OF THE WORLD does routinely.	2	edolmg7
>not to a non negligible extent buy a thesaurus	27	eddql9v
"Why do people think the ""tide pod challenge"" was a real thing and not just a meme?"	7	edeates
books are good	0	edrs6tq
Welcome to the Wild West. It's fucking amazing.	0,15	ee1uakc
Very cool of /[NAME] to host me for RPGs last night, and especially for stepping up to run a game on short notice. Thanks homie!	15	eekfmkh
I'm British and this has definitely happened to me.. but why is it just [NAME]?	7	ed1e0n2
That'll be a testical festival for sure. Have fun.	1,17	eeak3wk
Then there you have it. From everything I have seen thus far, this game is doomed. I hate saying that.	11	eebbk97
Some college professors and their teaching staff may need to die. Oh, wait... saying that is hate speech.	2	eesirne
Misread. I’m with you my dude.	5	ee4u7p9
It's a shame when a really attractive person does this to themself. Pretty eyes great smile.	0,9	eeppis0
Find some good rats bro, and just run thru them man. I mean just plow thru them and get your sex game up. 	27	edaxifb
The girl on the right got glass stuck in her leg poor girl	9	ee8h47p
Thats sexist AF, man boobs are a thing smh my head	27	ee5rz4o
Love and Hope from a dictator [NAME]? [NAME], [NAME] and [NAME] would have you think so.	27	edrke7q
No, everyone should should stop talking about the rights of groups of people, and start talking about *human* rights.	27	efh0qzg
Can confirm as my first time commuting by motorcycle in the rain there was hail, then lots of thunder bolts and lightning , found it very very frightening. 	14	efc9012
- There is no such thing as moral capitalism - Seizing the means of production is a communist thing, not a socialist thing. 	27	eemn5v2
I prefer the term window licker. The pub community loves the taste of windex.	4	eeyvm3d
Hey, [NAME] nerf to basic damage and no damage mitigation in stealth! Thank [NAME]!	15	ee5dy6r
"Oh man, Everytime someone asks what time it is my first instinct is to say ""it's time for lunch!"""	27	ef8utwz
I really like Funhaus	18	eeawofv
No, they don't. Make room for some different fighting styles.	27	ed6f0rd
Oh, the horror! We must defend the honor of Lord [NAME] against the scum of r/NFL!!	14	ed78un2
Oof thank you	15	ee7ef1z
Pulled from IG. IDK where it originated so no credit given. It's just making the rounds.	27	edxtho8
That goes both ways, their adrenaline and determination would also be through the fucking roof.	2	efazkwl
Oh, it’s actually its own thing. I heard goo and just assumed the worst.	9,12,22	edl1hkj
Really disappointed it's not even coming digitally on Vita outside of Japan.	9	edqfwbb
Maybe you’re not bringing as much to the table as you thought	27	eesnbfv
This. Thank you.	15	efb0h8w
Whenever I'm having a bad day, I watch a few eps of Cosmos to chill out.	17,23	edizvix
Long hair for guys should happen more, it looks cool *and feels nice too*	4,27	edrfqxl
You know [waves hand] Everyone.	27	ed1bg63
That’s really cool! How did you do this?	0	efbyyf1
Not really, more of a toxic poverty problem. Women get overworked too.	9	ee7zwiz
I tried to send this to a friend but [NAME] knocked it away.	9	eez2ljm
Yeah but you don't know if they're responsible for 2018 yet. Have to wait another year.	27	eevmgth
Yikes hope hes ok	27	eczemge
You are my beer god thank you haha	1,15,17	eejj4dy
Osaka making me nervous	19	ef06dpa
so you want things to get tied up for months???? just relax... nothing we can do but give it a few days	27	eempxuf
Surprised there isn’t more of this lol	26	ee02k2l
Nah when Telus does it so will Koodo since fido did	27	ed6ub1b
No Mayo No Care.	3	ee3qcuj
it's worth it not having to deal with ebay's laziness fixing stupid problems	4	ee99lur
At first I thought it was [NAME] and [NAME] lmfao	27	ee1ou04
One of these things is not like the other	27	ee707at
Why is he wearing his little sisters jeans? Bc she stole his juice. That's why	6	ed5x1f6
Thank you... I'll try but can't promise anything	15,20	edky5wr
>more money than you I seriously, *seriously* doubt that. >doing something before this guys are outta the country Prove it.	2	eebwhv4
Satire? He asked hopefully, yet with deep pessimism in his heart.	27	ee0tjvq
Stantler? It's one of the weaker gen 2 designs I guess. It'd be better if its nose wasnt so stupid	27	ef6wa8d
[NAME] approved this comment!	27	ee46802
You mean you love their meat right? You dont love chickens.	7	eek27vl
What you are describing is what I am feeling right now aswell. It's hard to handle the fact but atleast you aren't alone.	5,20	ed5o2v0
Save money and find a good partner so you can be financially stable with someone you love and do whatever you want the rest of your life.	5	ef6hdk0
Thanks! I'm going to Middlebury this fall but that's going on my resumé for the rest of my life tbh	15	ed3yeo8
Thanks the mental heath team at the hospital were good, I can always check in there, if it’s too much	15	eduzkpk
yep i don't know how are aren't up	6	eegdaz7
True. I'm not from the US so i dont know how they would go about enforcing this law.	4	ee9y74i
We saw them last year from Baker Beach. So many whales!	4	efc0bxa
This honestly explains so much. Thanks for some insight into myself lol	15	ef5glbc
Wow, I said he doesn't have any respect, it's not exactly proving my point to show how little you have, but thanks anyways.	3,15	eenyjhu
I think that in return they should sign [NAME] to a long term, cap friendly deal and send him back to us	27	edhe9ue
I love this reply.	18	ed6rjmp
Tickets to a 2008 Preliminary Final, paper print out version too, incredibly random.	27	ef91fxn
I like they think that it’s bad that we are thinking about the fucking POTUS. It’s almost like his actions effect us all	3,9	edzknzh
shhhh before you make the neocons angry	27	eecoemf
I'm not on it I was just wondering for the sake of knowing.	26	ee8htkr
I hope. Sirens got me excited	13,20	edcy7of
Just tell her you're going to get tested and she should as well just in case.	27	eeopdkw
It is an absolutely horrible ultimate I agree after 400 hours on doom I still hate it	14	ee4re4o
This South Florida girl loves Jaxons Ice Cream. Seeing the kitchen sink makes me want to drive home.	18	efee1jm
Remember to tuck and roll!	5	ee4ffet
Yeah, when I saw she was in LA, I really hope that. Oh please, be true.	15,17	eeprgfr
Me too. I love it!	18	eermytl
"She also spoke out quite angrily about ""Obamacare"" until she needed it due to her high risk pregnancy. She's remarkably hypocritical."	3	ed7p2gh
Not an ulcer (canker sore), like literally a tastebud	27	edu3jav
I like your colour choices and I can feel your love of the city. Keep up the art! Sending you lots of love and healing.	5,18	eds2hpj
I don't understand, was he purporting to be a priest? This list has him as a seminarian. 	6,7	eemlbbg
I would love to hear yours u/jellyjellyspace You posted a pretty unique topic	0	edk7zcv
Thank you. Let’s not blame one parent only for the existence of a child, or the batshitness of one coparent. 	15,22	ed3zu2v
I miss him so much during the NCAA tournament.	25	eey6mkp
What evidence at all shows that [NAME] was an accomplice?	6,7,27	ee6lcw2
I’m not sure how to feel after reading this... I will say that [NAME] and [NAME] would be an attractive couple.	4,20	efbt7si
Why anyone with unnaturally colored hair would even attempt that is beyond me.	27	edae6k1
Hahaha good point!	17	ee2zldj
I should have at your list that I only hope he gets elected!	27	edio74k
Yes. Exactly. Anything non [NAME] belongs in the trash. Glad you agree.	4	ee4ew6d
Ya know... a helmet never hurt anyone	4	ee0jf0v
>captain [NAME] Wow, great nickname. Do you and the president swap notes on this?	0,7	ee8sp0p
They will never find your body... MORE beautiful than all of your loving friends you wonderful person!	0	eed1tb2
WHAT!? *I thought you were a local!?*	7	edm9xl5
An Alabama DOINK!!	27	edj161z
So it isn’t pretty much the same? Glad you think I’m right then.	15	edzstm7
12 year old self wouldn’t understand how I put a pint of ice cream back in the fridge. It should be finished.	27	ee8rgei
Oh that's cheating then lol	1	eeo4tmt
I read it as him taking her virginity. Raping her...unless it was consensual and she WANTED to lose it.	11	ed2s60s
Also, keep an eye out for women who just want to use you for free drinks!	27	ee176av
May he Rest In Peace.	27	efedp7a
Your team lacks ethics.	10	eexk7b0
I work at an R1 university, with most of my team composed of CS/CE undergrad students. Yes, I've known many...	4,27	eevugbt
Agree! 60 new shoppers in Columbus I think is why. I removed Chillicothe and all those once but they came back. I am not going there!	4	edkg7zf
cause they want people to know there relvant again	27	eenjfmj
Doesn't even make sense. You don't say dollars 5 so why put the dollar sign in front	3	eebse1w
That destroys honor tho right ??	6,7	edi8ptc
Wooow! Thank you! Amazing	0,15	eev8ej9
That's a really interesting article. Has effectively nothing to do with myth making though.	4,13	eemu47f
I am your father's brother's nephew's cousin's former roommate.	27	edblik9
Fair enough. But he’d basically become an off tank with all that healing lol. I already get raped by reaper enough (tank main)	1	eer447c
I went to the exhibit in Chicago some years ago. It’s absolutely stunning	0	ed8e7os
You still sit when you piss.	27	eea70j7
god i love [NAME]	18	eedr5mw
Slacks casting, oh no here we go... I'm ready for the memes.	27	edkx7cv
The number of songs I've written that no one will hear. I've been working on some for 8+ years.	27	eerp2ah
when all I want to do is relax and chill and all she does is bounce off the wall yapping their mouth too much.	27	edth8lj
Be strong. I've felt the same way before in my living situation. I hope things go your way, keep us updated!	5,20	ed21q30
Point is, you’ll have to come clean. Sooner rather than later. And if she loves you, she can forgive you. 	18,20,27	eezdydc
British would annoy me more. Or being called British Isles	3	edtgb0u
[NAME] has broken his brain so bad he’s turning [NAME] into [NAME]	25	eektvsi
I didn't know they made phone calls ...	27	ed7mhbj
Where's the blindfold?	27	ed2cyww
"Also the sneezing. The dog is sneezing which is canine for ""this is a great game"""	0	edrls4n
But I want to look cute as I eat myself into immobility and an early grave. /s	27	efajjb3
I just guffawed at work. I hope your lawyer takes him to the cleaners.	20	edo2cp0
your mom likes to copy me cause she has no creativity just like you:	27	edq7cts
This kind of package probably wouldn't even get us Parayko	27	eea0172
The prevailing expectation is that Hulu will become 100% Disney owned in the future.	27	ee4bovl
If you think this is bad, you should've seen him at four.	27	eebed6e
That's not an actual thing you realise? No one is that stupid.	3	eew5ip4
Do it, and then post pictures. We're all counting on you!	27	edmfqv5
So good to see [NAME] back, looks like he hasn't lost a step.	17	eeatg47
I never thought about that last part - how cool! He is lucky to have you for an owner, you seem very caring!	0,5	ef85rcf
My great aunt was saved by the serum delivered by this dog.	27	ed387lu
Umm... I am.	27	ee0tvk2
I love the way he looks at them to see if he should keep panting.	0	ee4m9gs
Ah yes, taxes=Nazism. You [NAME] sure are a funny bunch.	1	eehtuly
That’s always good to be away from toxic people like that. Try to keep yourself from those types of people, they can ruin your life.	4,5	ed8mq8n
Let’s actually go	27	ed4ifcg
Right?? It makes no sense she’s horrible	11	eezw0wp
Ah ok well I have completed my bachelors degree so I’ll look into subbing as well.	4	edti0ld
Some people on here are infatuated with his infatuation.	22	edtgpm5
Alright, thanks	15	eefw4oh
I know you’re playin but it wouldn’t surprise me if I hear this for real	27	eeldjer
Cancer is even scarier my friend. Let's just hug it out	27	edmrelx
For some reason I can't reply to [NAME], but also for the neysayers:	27	edkyovx
Good luck!	15	eddnvb3
Hope you're ok!	5	edtph9k
My dad did this same trick when I was a kid	27	ed81k0l
Oh I can't wait until they have sole rights to our game.	13	eesdilk
istanbul and ankara matters. Also percentage-wise it acts as a nationwide survey. Out of ordinary results like below 38 or over 48 would be very important.	27	ee0iebt
Are we gonna ignore the fact that he passed someone in the right lane???? That’s illegal	7,10	eev0xru
Don't let her find out we do that here then. She'll want one.	27	edx4h00
I feel the same	27	eejpadt
Been closeted for 25 years, I feel like it made me the man I am today. 	27	ed78pqj
